timestamp,position,title,link
2026-03-27 01:19:26 UTC,1,Trump extends pause on striking Iranian energy plants by 10 days and says 'talks are ongoing',https://www.bbc.co.uk/news/live/cre0vl84qy9t
2026-03-27 01:19:26 UTC,2,"Under-5s should not be on screens for more than an hour a day, parents told in new government advice",https://www.bbc.co.uk/news/articles/c1d936n7445o
2026-03-27 01:19:26 UTC,3,Spanish woman dies by euthanasia after long legal battle with father,https://www.bbc.co.uk/news/articles/c7vqdd23y0vo
2026-03-27 01:19:26 UTC,4,US lawmaker makes direct plea to Sarah Ferguson to testify over 'close Epstein ties',https://www.bbc.co.uk/news/articles/c80m5y428xpo
2026-03-27 01:19:26 UTC,5,Zelensky visits Saudi Arabia after offering Ukraine's drone expertise,https://www.bbc.co.uk/news/articles/cx2r4wxdw3no
2026-03-27 01:19:26 UTC,6,Olivia Dean's streak continues as she wins big at Mobo Awards,https://www.bbc.co.uk/news/articles/clyerj082p1o
2026-03-27 01:19:26 UTC,7,Wales suffer agonising World Cup play-off shootout loss to Bosnia,https://www.bbc.co.uk/sport/football/live/c77mx3nyr05t
2026-03-27 01:19:26 UTC,8,Italy shatter Northern Ireland's World Cup bid,https://www.bbc.co.uk/sport/football/live/c895l8g2wj5t
2026-03-27 01:19:26 UTC,9,NS&I boss replaced as savers left waiting for millions of pounds,https://www.bbc.co.uk/news/articles/c3w3eg4n9zwo
2026-03-27 01:19:26 UTC,10,UK forecast to see biggest hit to growth from Iran war out of major economies,https://www.bbc.co.uk/news/articles/cgk0j71g417o
