timestamp,rank,title,link
2025-12-08 00:55:58 UTC,1,I'm A Celebrity 2025 winner crowned in series final,https://www.bbc.co.uk/news/articles/ceq17gne2j3o
2025-12-08 00:55:58 UTC,2,"Rayner will make return to cabinet, says Starmer",https://www.bbc.co.uk/news/articles/c7vmlmm9343o
2025-12-08 00:55:58 UTC,3,Child among those treated after pepper spray used in Heathrow robbery,https://www.bbc.co.uk/news/articles/c0q5l77qjd8o
2025-12-08 00:55:58 UTC,4,"New US security strategy aligns with Russia's vision, Moscow says",https://www.bbc.co.uk/news/articles/cpvd01g2kwwo
2025-12-08 00:55:58 UTC,5,Strictly semi-finalists confirmed after musicals week elimination,https://www.bbc.co.uk/news/articles/cwyxex7671xo
2025-12-08 00:55:58 UTC,6,Katy Perry goes Instagram official with Justin Trudeau,https://www.bbc.co.uk/news/articles/crmd44yz7nmo
2025-12-08 00:55:58 UTC,7,Sold 30 items on Vinted? Don't panic if you get a message about tax,https://www.bbc.co.uk/news/articles/c0mxe7l7wp1o
2025-12-08 00:55:58 UTC,8,"'Ketamine Queen' spiralled before Matthew Perry death, friends tell BBC",https://www.bbc.co.uk/news/articles/cjrjl1gy8r5o
2025-12-08 00:55:58 UTC,9,"Chernobyl radiation shield 'lost safety function' after drone strike, UN watchdog says",https://www.bbc.co.uk/news/articles/c98nldr06l2o
2025-12-08 00:55:58 UTC,10,Murder probe after child and woman die in Offaly house fire,https://www.bbc.co.uk/news/articles/cdd53m86dqgo
