timestamp,position,title,link
2026-06-20 03:46:37 UTC,1,Driver dies and 33 people seriously injured as Bedford train crash declared major incident,https://www.bbc.co.uk/news/articles/cr7xzg93ddxo
2026-06-20 03:46:37 UTC,2,Scotland's World Cup knockout hopes remain alive despite Morocco defeat,https://www.bbc.co.uk/sport/football/live/crr8dw70x51t
2026-06-20 03:46:37 UTC,3,PM under pressure from Labour MPs and ministers to set timetable for exit,https://www.bbc.co.uk/news/articles/cqx1ev0wn87o
2026-06-20 03:46:37 UTC,4,"Israel and Hezbollah agree ceasefire, US says, as more Lebanon strikes reported",https://www.bbc.co.uk/news/articles/cwyk7kkygj5o
2026-06-20 03:46:37 UTC,5,Why candidates dress up and run in major UK elections,https://www.bbc.co.uk/news/articles/cj9g3g28en1o
2026-06-20 03:46:37 UTC,6,Cooler Saturday gives brief relief before heat returns,https://www.bbc.co.uk/weather/articles/cp8lye61jk6o
2026-06-20 03:46:37 UTC,7,Turkey hit crossbar and post but Paraguay still 1-0 up in World Cup,https://www.bbc.co.uk/sport/football/live/c2kyg22l2n7t
2026-06-20 03:46:37 UTC,8,Driver dies and 33 people seriously injured as Bedford train crash declared major incident,https://www.bbc.co.uk/news/articles/cr7xzg93ddxo
2026-06-20 03:46:37 UTC,9,Scotland's World Cup knockout hopes remain alive despite Morocco defeat,https://www.bbc.co.uk/sport/football/live/crr8dw70x51t
2026-06-20 03:46:37 UTC,10,PM under pressure from Labour MPs and ministers to set timetable for exit,https://www.bbc.co.uk/news/articles/cqx1ev0wn87o
