timestamp,rank,title,link
2026-05-10 01:55:04 UTC,1,'Plot to oust Starmer' and 'Gord help us all',https://www.bbc.co.uk/news/articles/c5yrx3dl9vqo
2026-05-10 01:55:04 UTC,2,"Challenge Starmer by Monday or I will, Labour MP tells cabinet",https://www.bbc.co.uk/news/articles/cx210w87l4do
2026-05-10 01:55:04 UTC,3,Is Starmer's leadership under serious threat?,https://www.bbc.co.uk/news/articles/c8d81m665q5o
2026-05-10 01:55:04 UTC,4,Steve Rosenberg: This year's Victory Day parade in Moscow felt very different,https://www.bbc.co.uk/news/articles/cj9pem481rwo
2026-05-10 01:55:04 UTC,5,Britons on virus-hit cruise ship to isolate at hospital site,https://www.bbc.co.uk/news/articles/c2029r42w8wo
2026-05-10 01:55:04 UTC,6,Indian model's understated Met Gala debut revives debate on cultural representation,https://www.bbc.co.uk/news/articles/cre13zeql51o
2026-05-10 01:55:04 UTC,7,Putin says he thinks Ukraine conflict 'coming to an end',https://www.bbc.co.uk/news/articles/cn8p4j2jzwwo
2026-05-10 01:55:04 UTC,8,"Another year, another controversy for Eurovision - but fans are sticking by it",https://www.bbc.co.uk/news/articles/cqxp4959nwro
2026-05-10 01:55:04 UTC,9,"Our relationship with food is messed up - let's sort it out, says Stanley Tucci",https://www.bbc.co.uk/news/articles/c98r1k1j844o
2026-05-10 01:55:04 UTC,10,Teachers in England to vote on striking over pay,https://www.bbc.co.uk/news/articles/crlpdgxe317o
2026-05-10 05:29:32 UTC,1,'Plot to oust Starmer' and 'Gord help us all',https://www.bbc.co.uk/news/articles/c5yrx3dl9vqo
2026-05-10 05:29:32 UTC,2,Steve Rosenberg: This year's Victory Day parade in Moscow felt very different,https://www.bbc.co.uk/news/articles/cj9pem481rwo
2026-05-10 05:29:32 UTC,3,Is Starmer's leadership under serious threat?,https://www.bbc.co.uk/news/articles/c8d81m665q5o
2026-05-10 05:29:32 UTC,4,Putin says he thinks Ukraine conflict 'coming to an end',https://www.bbc.co.uk/news/articles/cn8p4j2jzwwo
2026-05-10 05:29:32 UTC,5,"Challenge Starmer by Monday or I will, Labour MP tells cabinet",https://www.bbc.co.uk/news/articles/cx210w87l4do
2026-05-10 05:29:32 UTC,6,"Our relationship with food is messed up - let's sort it out, says Stanley Tucci",https://www.bbc.co.uk/news/articles/c98r1k1j844o
2026-05-10 05:29:32 UTC,7,Tenerife medics poised to receive virus-hit cruise ship passengers,https://www.bbc.co.uk/news/articles/cn7pzmg8zeno
2026-05-10 05:29:32 UTC,8,"Another year, another controversy for Eurovision - but fans are sticking by it",https://www.bbc.co.uk/news/articles/cqxp4959nwro
2026-05-10 05:29:32 UTC,9,How the winner-takes-all voting system has turned on Labour and the Tories,https://www.bbc.co.uk/news/articles/cdxpqyndqwlo
2026-05-10 05:29:32 UTC,10,Teachers in England to vote on striking over pay,https://www.bbc.co.uk/news/articles/crlpdgxe317o
