timestamp,rank,title,link
2026-06-15 00:00:40 UTC,1,Thunderstorms threaten Trump's UFC cage fight on the White House lawn,https://www.bbc.co.uk/news/articles/c892xnwg5vlo
2026-06-15 00:00:40 UTC,2,Starmer set to ban under-16s from major social media platforms,https://www.bbc.co.uk/news/articles/cly7njlw95qo
2026-06-15 00:00:40 UTC,3,11 skydivers and pilot killed in US plane crash,https://www.bbc.co.uk/news/articles/c74ym4j40gpo
2026-06-15 00:00:40 UTC,4,"Roy Hattersley, former Labour deputy leader, dies aged 93",https://www.bbc.co.uk/news/articles/cvgq1egykr9o
2026-06-15 00:00:40 UTC,5,UK electric car sales target set to be weakened,https://www.bbc.co.uk/news/articles/cx2dmwmj4dmo
2026-06-15 00:00:40 UTC,6,Royal Marines board Russian shadow fleet oil tanker in English Channel,https://www.bbc.co.uk/news/articles/clyek039l2vo
2026-06-15 00:00:40 UTC,7,Swiss voters reject 10 million population cap,https://www.bbc.co.uk/news/articles/c20ygjem17zo
2026-06-15 00:00:40 UTC,8,Farage vows to ban foreign nationals from social housing,https://www.bbc.co.uk/news/articles/cdjkd4mp93zo
2026-06-15 00:00:40 UTC,9,Assisted dying returns to parliament as MP urges peers to 'finish the job',https://www.bbc.co.uk/news/articles/c4gyxgwkyxyo
2026-06-15 00:00:40 UTC,10,"'Boyfriend duties call,' Trudeau says after skipping Canada match to watch Perry",https://www.bbc.co.uk/news/articles/cly9eljexnno
