timestamp,position,title,link
2026-05-28 02:02:26 UTC,1,"'We are at risk of a lost generation': One in six young people will not be in work or training in five years without action, report warns",https://www.bbc.co.uk/news/articles/cy026x9jpd0o
2026-05-28 02:02:26 UTC,2,"I just want freedom from fear, says girl raped by teenage boys as sentences to be reviewed",https://www.bbc.co.uk/news/articles/cwy20d5440go
2026-05-28 02:02:26 UTC,3,"Girl tells BBC she is 'scared to go out' after teenage rapists spared jail time. Video, 00:01:03Girl tells BBC she is 'scared to go out' after teenage rapists spared jail time",https://www.bbc.co.uk/news/videos/cy024pdweppo
2026-05-28 02:02:26 UTC,4,An unhealthy focus on sex - Married at First Sight UK insiders on show's 'toxic' culture,https://www.bbc.co.uk/news/articles/cn7p1dg6j41o
2026-05-28 02:02:26 UTC,5,UK's rudest chalk figure gets a glow-up to stop it fading in the rain,https://www.bbc.co.uk/news/articles/cpvppe84lnvo
2026-05-28 02:02:26 UTC,6,Jill Biden says she thought husband was 'having a stroke' during 2024 debate,https://www.bbc.co.uk/news/articles/c99l270vy3no
2026-05-28 02:02:26 UTC,7,Safety warning after nine water-related deaths during heatwave,https://www.bbc.co.uk/news/articles/cp8plymvm47o
2026-05-28 02:02:26 UTC,8,"Family of mum, 30, shot dead outside Sheffield bar pay tribute to 'beautiful soul'",https://www.bbc.co.uk/news/articles/c0q2yle5e0yo
2026-05-28 02:02:26 UTC,9,US carries out new strikes on Iran military site,https://www.bbc.co.uk/news/articles/c98r2qy5809o
2026-05-28 02:02:26 UTC,10,Legal bid to block UK-backed French migrant detention centre,https://www.bbc.co.uk/news/articles/cdxpdqvdyz7o
2026-05-28 06:42:26 UTC,1,"One in six young people will not be in work or training in five years without action, report warns",https://www.bbc.co.uk/news/articles/cy026x9jpd0o
2026-05-28 06:42:26 UTC,2,"I just want freedom from fear, says girl raped by teenage boys as sentences to be reviewed",https://www.bbc.co.uk/news/articles/cwy20d5440go
2026-05-28 06:42:26 UTC,3,"Girl tells BBC she is 'scared to go out' after teenage rapists spared jail time. Video, 00:01:03Girl tells BBC she is 'scared to go out' after teenage rapists spared jail time",https://www.bbc.co.uk/news/videos/cy024pdweppo
2026-05-28 06:42:26 UTC,4,US strikes Iran targets for second time in three days,https://www.bbc.co.uk/news/articles/c98r2qy5809o
2026-05-28 06:42:26 UTC,5,An unhealthy focus on sex - Married at First Sight UK insiders on show's 'toxic' culture,https://www.bbc.co.uk/news/articles/cn7p1dg6j41o
2026-05-28 06:42:26 UTC,6,Jill Biden says she thought husband was having a stroke during 2024 debate,https://www.bbc.co.uk/news/articles/c99l270vy3no
2026-05-28 06:42:26 UTC,7,UK's rudest chalk figure gets a glow-up to stop it fading in the rain,https://www.bbc.co.uk/news/articles/cpvppe84lnvo
2026-05-28 06:42:26 UTC,8,Legal bid to block UK-backed French migrant detention centre,https://www.bbc.co.uk/news/articles/cdxpdqvdyz7o
2026-05-28 06:42:26 UTC,9,Israel strikes southern Lebanon after evacuation orders,https://www.bbc.co.uk/news/articles/cj3pgrpmlklo
2026-05-28 06:42:26 UTC,10,Safety warning after nine water-related deaths during heatwave,https://www.bbc.co.uk/news/articles/cp8plymvm47o
2026-05-28 10:43:47 UTC,1,"Young people facing 'perfect storm', report warns, as more than a million not in work or education",https://www.bbc.co.uk/news/live/clypw8gyn18t
2026-05-28 10:43:47 UTC,2,An unhealthy focus on sex - Married at First Sight UK insiders on show's 'toxic' culture,https://www.bbc.co.uk/news/articles/cn7p1dg6j41o
2026-05-28 10:43:47 UTC,3,Teenager is 10th person to die in water during heatwave,https://www.bbc.co.uk/news/articles/cn0p7j3lwepo
2026-05-28 10:43:47 UTC,4,The £5 coffee that tells a story of global economic turmoil,https://www.bbc.co.uk/news/articles/cr5pp1m6z06o
2026-05-28 10:43:47 UTC,5,Iran says it targeted American base after fresh US strikes,https://www.bbc.co.uk/news/articles/c98r2qy5809o
2026-05-28 10:43:47 UTC,6,Girl raped by teenage boys tells BBC: 'I'm scared I'm going to see them',https://www.bbc.co.uk/news/articles/cwy20d5440go
2026-05-28 10:43:47 UTC,7,"US justice department launches criminal investigation into Trump accuser E Jean Carroll, reports say",https://www.bbc.co.uk/news/articles/clyp77jd407o
2026-05-28 10:43:47 UTC,8,Heavy Israeli strikes hit southern Lebanon after large-scale evacuation orders,https://www.bbc.co.uk/news/articles/cj3pgrpmlklo
2026-05-28 10:43:47 UTC,9,Ousted BP chairman hits back at 'lies' about his behaviour,https://www.bbc.co.uk/news/articles/cy92rzn5v7vo
2026-05-28 10:43:47 UTC,10,Mother who murdered baby daughter jailed for at least 19 years,https://www.bbc.co.uk/news/articles/cvgz5ykr17eo
