timestamp,rank,title,link
2026-05-01 02:00:19 UTC,1,Chippies sell catfish as 'traditional fish supper',https://www.bbc.co.uk/news/articles/cvg0337n0y1o
2026-05-01 02:00:19 UTC,2,"UK should not keep changing prime ministers, warns John Major",https://www.bbc.co.uk/news/articles/cgepy0xw1nzo
2026-05-01 02:00:19 UTC,3,Banksy confirms he's behind statue in central London,https://www.bbc.co.uk/news/articles/c5y9wlnwl85o
2026-05-01 02:00:19 UTC,4,'PM vows to act' and 'Brace for more terror attacks',https://www.bbc.co.uk/news/articles/clyp5v46q74o
2026-05-01 02:00:19 UTC,5,New footage shows how Trump dinner gunman charged through security in four seconds,https://www.bbc.co.uk/news/articles/c4g7rmrlm17o
2026-05-01 02:00:19 UTC,6,Trump to remove whisky tariffs after King's visit,https://www.bbc.co.uk/news/articles/cjrp3pew2d5o
2026-05-01 02:00:19 UTC,7,UK terrorism threat level raised to severe after Golders Green attack,https://www.bbc.co.uk/news/articles/cq6p4pz6p62o
2026-05-01 02:00:19 UTC,8,Teens who killed man with rocks and a bottle sentenced,https://www.bbc.co.uk/news/articles/c1m290e0x3xo
2026-05-01 02:00:19 UTC,9,Fertiliser boss says war puts 10 billion meals a week at risk,https://www.bbc.co.uk/news/articles/cpwp50v4ye7o
2026-05-01 02:00:19 UTC,10,'I held down Golders Green suspect' says volunteer who grabbed ankle,https://www.bbc.co.uk/news/articles/cn7pyp13y8no
2026-05-01 05:44:10 UTC,1,Chippies sell catfish as 'traditional fish supper',https://www.bbc.co.uk/news/articles/cvg0337n0y1o
2026-05-01 05:44:10 UTC,2,"UK should not keep changing prime ministers, warns John Major",https://www.bbc.co.uk/news/articles/cgepy0xw1nzo
2026-05-01 05:44:10 UTC,3,New footage shows how Trump dinner gunman charged through security in four seconds,https://www.bbc.co.uk/news/articles/c4g7rmrlm17o
2026-05-01 05:44:10 UTC,4,'PM vows to act' and 'Brace for more terror attacks',https://www.bbc.co.uk/news/articles/clyp5v46q74o
2026-05-01 05:44:10 UTC,5,King arrives in Bermuda after ending US trip with visit to small town America,https://www.bbc.co.uk/news/articles/cdrpjm47jv4o
2026-05-01 05:44:10 UTC,6,British couple jailed in Iran: 'We're likely to be here for a long time',https://www.bbc.co.uk/news/articles/c202pl60kv9o
2026-05-01 05:44:10 UTC,7,What the Renters' Rights Act means for tenants and landlords,https://www.bbc.co.uk/news/articles/cqjwqp72y7ro
2026-05-01 05:44:10 UTC,8,Britney Spears charged in California with driving under influence,https://www.bbc.co.uk/news/articles/clyp6r9dzedo
2026-05-01 05:44:10 UTC,9,Fertiliser boss says war puts 10 billion meals a week at risk,https://www.bbc.co.uk/news/articles/cpwp50v4ye7o
2026-05-01 05:44:10 UTC,10,"Public told 'be alert, not alarmed' as terror threat level raised after Golders Green attack",https://www.bbc.co.uk/news/articles/cq6p4pz6p62o
