timestamp,rank,title,link
2026-06-11 00:07:52 UTC,1,Iran says it struck ships in Strait of Hormuz after US launches new strikes,https://www.bbc.co.uk/news/articles/c4gyp9v0e93o
2026-06-11 00:07:52 UTC,2,Water cannon fired in latest disorder after Belfast knife attack,https://www.bbc.co.uk/news/articles/c1dypzw1d29o
2026-06-11 00:07:52 UTC,3,Mike Ashley's Frasers offers £1.73bn to buy all of Hugo Boss,https://www.bbc.co.uk/news/articles/c07y92gplmyo
2026-06-11 00:07:52 UTC,4,"Changing visa rules for care workers is wrong, says Rayner",https://www.bbc.co.uk/news/articles/cddl0nz4v5vo
2026-06-11 00:07:52 UTC,5,Essex Police given new David Sullivan information,https://www.bbc.co.uk/news/articles/c802l191rd3o
2026-06-11 00:07:52 UTC,6,Vets advise ban on over the counter flea treatment for pets,https://www.bbc.co.uk/news/articles/cp9pd4d3m5ko
2026-06-11 00:07:52 UTC,7,Whale graveyard dating back five million years discovered,https://www.bbc.co.uk/news/articles/c75ylx4xn10o
2026-06-11 00:07:52 UTC,8,The furious dispute over what caused Air India flight 171 to crash,https://www.bbc.co.uk/news/articles/cwyk9exxp2qo
2026-06-11 00:07:52 UTC,9,'Second night of unrest' and 'Yes we Kansas',https://www.bbc.co.uk/news/articles/c75yl9r0evno
2026-06-11 00:07:52 UTC,10,"'Two of my children play for England, I still pinch myself'",https://www.bbc.co.uk/news/articles/cx2x5l2yyqpo
