timestamp,position,title,link
2025-11-25 00:53:05 UTC,1,BBC chairman vows to stay to 'fix' problems,https://www.bbc.co.uk/news/articles/c62lr2yjy14o
2025-11-25 00:53:05 UTC,2,BBC chairman survives MPs' questions – but crisis at corporation is not over,https://www.bbc.co.uk/news/articles/c0l9pp61xr5o
2025-11-25 00:53:05 UTC,3,Zelensky welcomes amendments to proposed peace plan,https://www.bbc.co.uk/news/articles/cpd6qd10l94o
2025-11-25 00:53:05 UTC,4,Updated peace plan could be a deal Ukraine will take - eventually,https://www.bbc.co.uk/news/articles/cn4d27dx80no
2025-11-25 00:53:05 UTC,5,How X's new location feature exposed big US politics accounts,https://www.bbc.co.uk/news/articles/cj38m11218xo
2025-11-25 00:53:05 UTC,6,Elderly man 'broken' after losing £35k in online scams,https://www.bbc.co.uk/news/articles/c07m7xly9zro
2025-11-25 00:53:05 UTC,7,Has Britain's budget watchdog become too all-powerful?,https://www.bbc.co.uk/news/articles/clyx9n5p7v7o
2025-11-25 00:53:05 UTC,8,Farage says he's 'never directly racially abused anybody' after school racism claims,https://www.bbc.co.uk/news/articles/c87lx0981nro
2025-11-25 00:53:05 UTC,9,"Police officer unable to dress after hammer attack by Palestine Action activist, jury told",https://www.bbc.co.uk/news/articles/c4g54g1r15eo
2025-11-25 00:53:05 UTC,10,Trump says he will visit China in April after call with Xi,https://www.bbc.co.uk/news/articles/ckgdr1vlz7ko
