timestamp,position,title,link
2025-06-17 00:54:48 UTC,1,Explosions heard in Tehran as Trump tells 'everyone' to evacuate Iranian capital immediately,https://www.bbc.co.uk/news/live/c2kqkd03xn5t
2025-06-17 00:54:48 UTC,2,Lyse Doucet: Where is Israel's operation heading?,https://www.bbc.co.uk/news/articles/ce829v2qzyro
2025-06-17 00:54:48 UTC,3,"Trump to cut short G7 visit, citing Middle East, after signing deal with Starmer",https://www.bbc.co.uk/news/live/cvg92p19n4xt
2025-06-17 00:54:48 UTC,4,"Ethnicity of grooming gangs 'shied away from', Casey report says",https://www.bbc.co.uk/news/articles/clynyyqdnrdo
2025-06-17 00:54:48 UTC,5,Woman who died in skydive was 'caring and giving',https://www.bbc.co.uk/news/articles/cy4e4jmzep4o
2025-06-17 00:54:48 UTC,6,First heatwave of 2025 likely as temperatures to surge above 30C,https://www.bbc.co.uk/weather/articles/c4grg1w2xr7o
2025-06-17 00:54:48 UTC,7,Family of Air India crash victims feel 'abandoned',https://www.bbc.co.uk/news/articles/c5y0lwreg9qo
2025-06-17 00:54:48 UTC,8,Juror dismissed in Diddy trial over 'inconsistencies',https://www.bbc.co.uk/news/articles/ckg4gg626p2o
2025-06-17 00:54:48 UTC,9,"Dozens killed by Israeli fire near Gaza aid sites, Hamas-run ministry says",https://www.bbc.co.uk/news/articles/cg7177gpr17o
2025-06-17 00:54:48 UTC,10,Nursery worker convicted of abusing 21 babies,https://www.bbc.co.uk/news/articles/clylww5ykkvo
