timestamp,rank,title,link
2026-01-26 01:04:13 UTC,1,Andy Burnham 'disappointed' after bid to become MP blocked,https://www.bbc.co.uk/news/articles/czr4e7ep468o
2026-01-26 01:04:13 UTC,2,"Make sure pupils don't ever use phones at school, Phillipson tells teachers",https://www.bbc.co.uk/news/articles/cgk827r8mrzo
2026-01-26 01:04:13 UTC,3,Hundreds of thousands without power as winter storm hits US,https://www.bbc.co.uk/news/articles/c1klrmz90yjo
2026-01-26 01:04:13 UTC,4,Murder and MI5: How an extraordinary battle erupted over what the state keeps secret,https://www.bbc.co.uk/news/articles/c1w94v205y2o
2026-01-26 01:04:13 UTC,5,Chris Mason: Burnham saga unlikely to be last act in drama of Starmer's leadership,https://www.bbc.co.uk/news/articles/cpwnjdnz2n5o
2026-01-26 01:04:13 UTC,6,"Russia using Interpol's wanted list to target critics abroad, leak reveals",https://www.bbc.co.uk/news/articles/c20gg729y1yo
2026-01-26 01:04:13 UTC,7,"Who was Alex Pretti, the intensive care nurse shot dead in Minneapolis?",https://www.bbc.co.uk/news/articles/c62r4g590wqo
2026-01-26 01:04:13 UTC,8,Captain of suspected Russian shadow tanker in French custody,https://www.bbc.co.uk/news/articles/c62vke5dly2o
2026-01-26 01:04:13 UTC,9,Davey says war bonds would help to speed up UK defence spending,https://www.bbc.co.uk/news/articles/cq5y7edg169o
2026-01-26 01:04:13 UTC,10,Clean-up after 'devastating' storm wreaks havoc,https://www.bbc.co.uk/news/articles/ce8gldd9zyyo
