timestamp,position,title,link
2026-02-21 01:07:27 UTC,1,Trump brings in new 10% tariff as Supreme Court rejects his global import taxes,https://www.bbc.co.uk/news/articles/cn8146l0n55o
2026-02-21 01:07:27 UTC,2,Government considers removing Andrew from royal line of succession,https://www.bbc.co.uk/news/articles/c1kgv837wvdo
2026-02-21 01:07:27 UTC,3,"Andrew and King Charles, a personal battle of royal brothers",https://www.bbc.co.uk/news/articles/czx4y1l1nq4o
2026-02-21 01:07:27 UTC,4,Trump says he is considering limited military strike on Iran,https://www.bbc.co.uk/news/articles/cdxzk4gvzp0o
2026-02-21 01:07:27 UTC,5,Humans to travel further into space than ever before as Nasa confirms March Moon mission,https://www.bbc.co.uk/news/articles/c86y1g6wde3o
2026-02-21 01:07:27 UTC,6,Tributes paid to teens who died at holiday park,https://www.bbc.co.uk/news/articles/c4g8rdp6lrvo
2026-02-21 01:07:27 UTC,7,The best looks at London Fashion Week 2026,https://www.bbc.co.uk/news/articles/c4g0ke64v3no
2026-02-21 01:07:27 UTC,8,Couple left with $200k bill after baby born in US,https://www.bbc.co.uk/news/articles/cx2r7d4gzz1o
2026-02-21 01:07:27 UTC,9,Sam Fender and Olivia Dean finally reach number one after 35 weeks,https://www.bbc.co.uk/news/articles/cq6q9m016l5o
2026-02-21 01:07:27 UTC,10,"KFC, Nando's, and others ditch chicken welfare pledge",https://www.bbc.co.uk/news/articles/cm2r6jqm042o
