timestamp,position,title,link
2026-06-11 00:07:52 UTC,1,Water cannon fired in latest disorder after Belfast knife attack,https://www.bbc.co.uk/news/articles/c1dypzw1d29o
2026-06-11 00:07:52 UTC,2,Iran says it struck ships in Strait of Hormuz after US launches new strikes,https://www.bbc.co.uk/news/articles/c4gyp9v0e93o
2026-06-11 00:07:52 UTC,3,Essex Police given new information on West Ham co-owner David Sullivan,https://www.bbc.co.uk/news/articles/c802l191rd3o
2026-06-11 00:07:52 UTC,4,England impress to beat Costa Rica in final World Cup warm-up,https://www.bbc.co.uk/sport/football/live/c5yeyn44rejt
2026-06-11 00:07:52 UTC,5,"Fireworks illuminate Barcelona's Sagrada Família during Pope visit. Video, 00:01:06Fireworks illuminate Barcelona's Sagrada Família during Pope visit",https://www.bbc.co.uk/news/videos/ce95gmdlp98o
2026-06-11 00:07:52 UTC,6,"Smacking children could lead to lower GCSE grades, study suggests",https://www.bbc.co.uk/news/articles/c2eyke83yz9o
2026-06-11 00:07:52 UTC,7,Which World Cup stars have roots near you?,https://www.bbc.co.uk/news/articles/cn75y330kpjo
2026-06-11 00:07:52 UTC,8,Mike Ashley's Frasers offers £1.73bn to buy all of Hugo Boss,https://www.bbc.co.uk/news/articles/c07y92gplmyo
2026-06-11 00:07:52 UTC,9,The furious dispute over what caused Air India flight 171 to crash,https://www.bbc.co.uk/news/articles/cwyk9exxp2qo
2026-06-11 00:07:52 UTC,10,"Changing visa rules for care workers is wrong, says Rayner",https://www.bbc.co.uk/news/articles/cddl0nz4v5vo
2026-06-11 05:20:03 UTC,1,Water cannon fired in latest disorder after Belfast knife attack,https://www.bbc.co.uk/news/articles/c1dypzw1d29o
2026-06-11 05:20:03 UTC,2,US and Iran exchange strikes across Middle East for second day in a row,https://www.bbc.co.uk/news/articles/c4gyp9v0e93o
2026-06-11 05:20:03 UTC,3,Essex Police given new information on West Ham co-owner David Sullivan,https://www.bbc.co.uk/news/articles/c802l191rd3o
2026-06-11 05:20:03 UTC,4,England impress to beat Costa Rica in final World Cup warm-up,https://www.bbc.co.uk/sport/football/live/c5yeyn44rejt
2026-06-11 05:20:03 UTC,5,The furious dispute over what caused Air India flight 171 to crash,https://www.bbc.co.uk/news/articles/cwyk9exxp2qo
2026-06-11 05:20:03 UTC,6,"Fireworks illuminate Barcelona's Sagrada Família during Pope visit. Video, 00:01:06Fireworks illuminate Barcelona's Sagrada Família during Pope visit",https://www.bbc.co.uk/news/videos/ce95gmdlp98o
2026-06-11 05:20:03 UTC,7,Who is your nearest World Cup hero?,https://www.bbc.co.uk/news/articles/cn75y330kpjo
2026-06-11 05:20:03 UTC,8,Trump says he 'loves the inflation' as US prices rise at fastest rate in three years,https://www.bbc.co.uk/news/articles/c0myzxjkw99o
2026-06-11 05:20:03 UTC,9,"Smacking children could lead to lower GCSE grades, study suggests",https://www.bbc.co.uk/news/articles/c2eyke83yz9o
2026-06-11 05:20:03 UTC,10,Mike Ashley's Frasers offers £1.73bn to buy all of Hugo Boss,https://www.bbc.co.uk/news/articles/c07y92gplmyo
2026-06-11 10:04:04 UTC,1,Northern Ireland secretary warns of 'sense of fear' among ethnic minorities after second night of riots,https://www.bbc.co.uk/news/live/c70y4pppp4wt
2026-06-11 10:04:04 UTC,2,"Three Indian sailors killed by US missile near Oman, as US and Iran exchange strikes",https://www.bbc.co.uk/news/live/cly7nr3jzv5t
2026-06-11 10:04:04 UTC,3,World Cup 2026: Who will win each group? Join debate as Mexico prepares for opener,https://www.bbc.co.uk/sport/football/live/cvg4wnxpppnt
2026-06-11 10:04:04 UTC,4,Find your local World Cup hero with our postcode lookup,https://www.bbc.co.uk/news/articles/cn75y330kpjo
2026-06-11 10:04:04 UTC,5,"Nearly 3,000 patients a day in England face corridor care in NHS",https://www.bbc.co.uk/news/articles/cp3657re2epo
2026-06-11 10:04:04 UTC,6,Olivia Rodrigo on heartbreak and choosing her wedding song,https://www.bbc.co.uk/news/articles/cly83elvz70o
2026-06-11 10:04:04 UTC,7,"Facing a seismic by-election, the people of Makerfield tell us what matters to them",https://www.bbc.co.uk/news/articles/ckg4dywykjeo
2026-06-11 10:04:04 UTC,8,Ryanair investigated over charging parents to sit with children,https://www.bbc.co.uk/news/articles/czj87rvx349o
2026-06-11 10:04:04 UTC,9,"Make stolen phones unusable, Met Police urges tech giants",https://www.bbc.co.uk/news/articles/ckg4dey905yo
2026-06-11 10:04:04 UTC,10,Pope Leo visits Canary Islands to highlight perilous journeys of migrants,https://www.bbc.co.uk/news/articles/cn59w6p3vd0o
2026-06-11 14:28:41 UTC,1,John Healey resigns as defence secretary saying Starmer's military spending plans 'fall well short',https://www.bbc.co.uk/news/live/cgqeg09p3p1t
2026-06-11 14:28:41 UTC,2,Chris Mason: Healey's resignation is a devastating critique of Starmer's government,https://www.bbc.co.uk/news/articles/cm20vznj2p2o
2026-06-11 14:28:41 UTC,3,"Police vow 'robust' response to Northern Ireland riots with extra officers, dogs and water cannon deployed",https://www.bbc.co.uk/news/live/c70y4pppp4wt
2026-06-11 14:28:41 UTC,4,Trump says US will hit Iran 'very hard' tonight and threatens to take Kharg Island,https://www.bbc.co.uk/news/live/cly7nr3jzv5t
2026-06-11 14:28:41 UTC,5,"El Niño under way and threatens weather extremes, scientists say",https://www.bbc.co.uk/news/articles/c75ylx7g00xo
2026-06-11 14:28:41 UTC,6,"Police officer, 19, dies from crash injuries",https://www.bbc.co.uk/news/articles/c621l2nkz4ko
2026-06-11 14:28:41 UTC,7,Olivia Rodrigo on heartbreak and choosing her wedding song,https://www.bbc.co.uk/news/articles/cly83elvz70o
2026-06-11 14:28:41 UTC,8,Rapist jailed for trafficking and abusing girls,https://www.bbc.co.uk/news/articles/cwy0v8741pxo
2026-06-11 14:28:41 UTC,9,"Facing a seismic by-election, the people of Makerfield tell us what matters to them",https://www.bbc.co.uk/news/articles/ckg4dywykjeo
2026-06-11 14:28:41 UTC,10,More Henry Nowak protesters being sentenced over violent disorder in Southampton,https://www.bbc.co.uk/news/live/cnv9j7zdvz8t
