timestamp,position,title,link
2025-11-08 00:50:09 UTC,1,Algerian sex offender mistakenly released from Wandsworth prison arrested,https://www.bbc.co.uk/news/articles/c625grkxg05o
2025-11-08 00:50:09 UTC,2,Trump says he may give Hungary an exemption on Russian oil sanctions,https://www.bbc.co.uk/news/articles/cp85dvnkpv4o
2025-11-08 00:50:09 UTC,3,Why this woman believed she was Madeleine McCann - and what she did next,https://www.bbc.co.uk/news/articles/c2lpgz1rx8xo
2025-11-08 00:50:09 UTC,4,'We had to create a human chain to evacuate' - Jamaican hospital rebuilds after hurricane,https://www.bbc.co.uk/news/articles/c20p87m541xo
2025-11-08 00:50:09 UTC,5,DNA pioneer James Watson dies at 97,https://www.bbc.co.uk/news/articles/cn8xdypnz32o
2025-11-08 00:50:09 UTC,6,British ex-soldier arrested over alleged murder of Kenyan woman in 2012,https://www.bbc.co.uk/news/articles/c8jrkyzn8dvo
2025-11-08 00:50:09 UTC,7,Ex-footballer Joey Barton guilty over 'grossly offensive' X posts,https://www.bbc.co.uk/news/articles/cwykwlkewr7o
2025-11-08 00:50:09 UTC,8,Whip restored to four Labour MPs after rebellion,https://www.bbc.co.uk/news/articles/cgmxeyr8k8eo
2025-11-08 00:50:09 UTC,9,Thousands of flights cancelled or delayed in US as air traffic control hit by government shutdown,https://www.bbc.co.uk/news/live/c20ez8y0dv1t
2025-11-08 00:50:09 UTC,10,What does Elon Musk do with all his money?,https://www.bbc.co.uk/news/articles/c1wl5wj39zjo
2025-11-08 02:18:54 UTC,1,"At least four prisoners freed in error still at large, BBC told",https://www.bbc.co.uk/news/articles/cn51329exkqo
2025-11-08 02:18:54 UTC,2,Trump says he may give Hungary an exemption on Russian oil sanctions,https://www.bbc.co.uk/news/articles/cp85dvnkpv4o
2025-11-08 02:18:54 UTC,3,Why this woman believed she was Madeleine McCann - and what she did next,https://www.bbc.co.uk/news/articles/c2lpgz1rx8xo
2025-11-08 02:18:54 UTC,4,'We had to create a human chain to evacuate' - Jamaican hospital rebuilds after hurricane,https://www.bbc.co.uk/news/articles/c20p87m541xo
2025-11-08 02:18:54 UTC,5,DNA pioneer James Watson dies at 97,https://www.bbc.co.uk/news/articles/cn8xdypnz32o
2025-11-08 02:18:54 UTC,6,British ex-soldier arrested over alleged murder of Kenyan woman in 2012,https://www.bbc.co.uk/news/articles/c8jrkyzn8dvo
2025-11-08 02:18:54 UTC,7,Thousands of US flights cancelled or delayed over government shutdown cuts,https://www.bbc.co.uk/news/articles/c20eq1vnjj5o
2025-11-08 02:18:54 UTC,8,Tories call for Starmer to face probe over football watchdog,https://www.bbc.co.uk/news/articles/cp85dxd60gko
2025-11-08 02:18:54 UTC,9,Blame game over Air India crash goes on,https://www.bbc.co.uk/news/articles/c33pzypkkdzo
2025-11-08 02:18:54 UTC,10,What does Elon Musk do with all his money?,https://www.bbc.co.uk/news/articles/c1wl5wj39zjo
