timestamp,rank,title,link
2026-02-10 01:23:03 UTC,1,Catherine O'Hara cause of death confirmed as pulmonary embolism,https://www.bbc.co.uk/news/articles/ckg19nql0w8o
2026-02-10 01:23:03 UTC,2,King's 'profound concern' as police consider Andrew claims over Epstein,https://www.bbc.co.uk/news/articles/cqlgv3z79klo
2026-02-10 01:23:03 UTC,3,Maxwell refuses to answer questions about Epstein in congressional hearing,https://www.bbc.co.uk/news/articles/cvgv5yre39zo
2026-02-10 01:23:03 UTC,4,Streeting's Mandelson messages reveal election fears and criticism of government,https://www.bbc.co.uk/news/articles/c4gjle7g13xo
2026-02-10 01:23:03 UTC,5,Trump's world order hangs over Europe on eve of key defence conference,https://www.bbc.co.uk/news/articles/cgrzjv1kykxo
2026-02-10 01:23:03 UTC,6,Sarwar makes his biggest political gamble - but can it pay off?,https://www.bbc.co.uk/news/articles/c6264y17z5yo
2026-02-10 01:23:03 UTC,7,Cabinet ministers rally round PM as Sarwar urges him to quit,https://www.bbc.co.uk/news/articles/c89kwj8kjy9o
2026-02-10 01:23:03 UTC,8,£5bn council SEND debts to be paid off by government,https://www.bbc.co.uk/news/articles/cjd95572xpeo
2026-02-10 01:23:03 UTC,9,Australia PM 'devastated' as police and protesters clash over Israeli leader's visit,https://www.bbc.co.uk/news/articles/cn0zed0dekgo
2026-02-10 01:23:03 UTC,10,'We are at an hour of desperation' - Savannah Guthrie pleads for help for missing mother,https://www.bbc.co.uk/news/articles/c4geqzqd8qeo
