timestamp,rank,title,link
2026-06-11 00:07:52 UTC,1,Iran says it struck ships in Strait of Hormuz after US launches new strikes,https://www.bbc.co.uk/news/articles/c4gyp9v0e93o
2026-06-11 00:07:52 UTC,2,Water cannon fired in latest disorder after Belfast knife attack,https://www.bbc.co.uk/news/articles/c1dypzw1d29o
2026-06-11 00:07:52 UTC,3,Mike Ashley's Frasers offers £1.73bn to buy all of Hugo Boss,https://www.bbc.co.uk/news/articles/c07y92gplmyo
2026-06-11 00:07:52 UTC,4,"Changing visa rules for care workers is wrong, says Rayner",https://www.bbc.co.uk/news/articles/cddl0nz4v5vo
2026-06-11 00:07:52 UTC,5,Essex Police given new David Sullivan information,https://www.bbc.co.uk/news/articles/c802l191rd3o
2026-06-11 00:07:52 UTC,6,Vets advise ban on over the counter flea treatment for pets,https://www.bbc.co.uk/news/articles/cp9pd4d3m5ko
2026-06-11 00:07:52 UTC,7,Whale graveyard dating back five million years discovered,https://www.bbc.co.uk/news/articles/c75ylx4xn10o
2026-06-11 00:07:52 UTC,8,The furious dispute over what caused Air India flight 171 to crash,https://www.bbc.co.uk/news/articles/cwyk9exxp2qo
2026-06-11 00:07:52 UTC,9,'Second night of unrest' and 'Yes we Kansas',https://www.bbc.co.uk/news/articles/c75yl9r0evno
2026-06-11 00:07:52 UTC,10,"'Two of my children play for England, I still pinch myself'",https://www.bbc.co.uk/news/articles/cx2x5l2yyqpo
2026-06-11 05:20:03 UTC,1,Trump says he 'loves the inflation' as US prices rise at fastest rate in three years,https://www.bbc.co.uk/news/articles/c0myzxjkw99o
2026-06-11 05:20:03 UTC,2,US and Iran exchange strikes across Middle East for second day in a row,https://www.bbc.co.uk/news/articles/c4gyp9v0e93o
2026-06-11 05:20:03 UTC,3,Water cannon fired in latest disorder after Belfast knife attack,https://www.bbc.co.uk/news/articles/c1dypzw1d29o
2026-06-11 05:20:03 UTC,4,'Second night of unrest' and 'Yes we Kansas',https://www.bbc.co.uk/news/articles/c75yl9r0evno
2026-06-11 05:20:03 UTC,5,The furious dispute over what caused Air India flight 171 to crash,https://www.bbc.co.uk/news/articles/cwyk9exxp2qo
2026-06-11 05:20:03 UTC,6,Essex Police given new David Sullivan information,https://www.bbc.co.uk/news/articles/c802l191rd3o
2026-06-11 05:20:03 UTC,7,Mike Ashley's Frasers offers £1.73bn to buy all of Hugo Boss,https://www.bbc.co.uk/news/articles/c07y92gplmyo
2026-06-11 05:20:03 UTC,8,"Smacking children could lead to lower GCSE grades, study suggests",https://www.bbc.co.uk/news/articles/c2eyke83yz9o
2026-06-11 05:20:03 UTC,9,Which World Cup stars have roots near you?,https://www.bbc.co.uk/news/articles/cn75y330kpjo
2026-06-11 05:20:03 UTC,10,An Everest guide's miraculous survival raises questions for tourism industry,https://www.bbc.co.uk/news/articles/c1ly4p25jyvo
2026-06-11 10:04:04 UTC,1,Ryanair investigated over charging parents to sit with children,https://www.bbc.co.uk/news/articles/czj87rvx349o
2026-06-11 10:04:04 UTC,2,Olivia Rodrigo sings about heartbreak but she's already chosen her wedding song,https://www.bbc.co.uk/news/articles/cly83elvz70o
2026-06-11 10:04:04 UTC,3,"Facing a seismic by-election, the people of Makerfield tell us what matters to them",https://www.bbc.co.uk/news/articles/ckg4dywykjeo
2026-06-11 10:04:04 UTC,4,An Everest guide's miraculous survival raises questions for tourism industry,https://www.bbc.co.uk/news/articles/c1ly4p25jyvo
2026-06-11 10:04:04 UTC,5,"Make stolen phones unusable, Met Police urges tech giants",https://www.bbc.co.uk/news/articles/ckg4dey905yo
2026-06-11 10:04:04 UTC,6,The furious dispute over what caused Air India flight 171 to crash,https://www.bbc.co.uk/news/articles/cwyk9exxp2qo
2026-06-11 10:04:04 UTC,7,Which World Cup stars have roots near you?,https://www.bbc.co.uk/news/articles/cn75y330kpjo
2026-06-11 10:04:04 UTC,8,'Hidden house' farmer hits back after conviction,https://www.bbc.co.uk/news/articles/cwy20de67l1o
2026-06-11 10:04:04 UTC,9,'Second night of unrest' and 'Yes we Kansas',https://www.bbc.co.uk/news/articles/c75yl9r0evno
2026-06-11 10:04:04 UTC,10,"Nearly 3,000 patients a day face corridor care in NHS",https://www.bbc.co.uk/news/articles/cp3657re2epo
