timestamp,rank,title,link
2026-05-03 01:51:57 UTC,1,"Airlines can cancel flights in advance over fuel shortages, under new plans",https://www.bbc.co.uk/news/articles/c794zd1vqn4o
2026-05-03 01:51:57 UTC,2,'£7m tax bill for William' and 'Traitors take their places',https://www.bbc.co.uk/news/articles/cewp2wl7lg5o
2026-05-03 01:51:57 UTC,3,"King's speech was a 'high stakes' moment of US visit, Palace says",https://www.bbc.co.uk/news/articles/cy72d4g5pdyo
2026-05-03 01:51:57 UTC,4,Man charged after bomb hoax at Peter Kay show,https://www.bbc.co.uk/news/articles/c1d2pvle9lqo
2026-05-03 01:51:57 UTC,5,The Iran war has strengthened Ukraine in surprising ways. Could a ceasefire with Russia be closer?,https://www.bbc.co.uk/news/articles/cgjp7vpee03o
2026-05-03 01:51:57 UTC,6,Germany says US troop withdrawal 'foreseeable' as Nato seeks clarification,https://www.bbc.co.uk/news/articles/cd9pn541jjlo
2026-05-03 01:51:57 UTC,7,"From beds to LED masks, is the red light craze giving us more than just a warm glow?",https://www.bbc.co.uk/news/articles/c2lw59jrdkxo
2026-05-03 01:51:57 UTC,8,What death doulas can teach us about dying,https://www.bbc.co.uk/news/articles/cp9vp0ld1leo
2026-05-03 01:51:57 UTC,9,Star-studded line-up announced for Celebrity Traitors series two,https://www.bbc.co.uk/news/articles/c5yx5w43jzko
2026-05-03 01:51:57 UTC,10,Four injured in Brixton drive-by shooting,https://www.bbc.co.uk/news/articles/cj3pmgpgneno
2026-05-03 05:21:54 UTC,1,"Airlines can cancel flights in advance over fuel shortages, under new plans",https://www.bbc.co.uk/news/articles/c794zd1vqn4o
2026-05-03 05:21:54 UTC,2,'£7m tax bill for William' and 'Traitors take their places',https://www.bbc.co.uk/news/articles/cewp2wl7lg5o
2026-05-03 05:21:54 UTC,3,"King's speech was a 'high stakes' moment of US visit, Palace says",https://www.bbc.co.uk/news/articles/cy72d4g5pdyo
2026-05-03 05:21:54 UTC,4,The Iran war has strengthened Ukraine in surprising ways. Could a ceasefire with Russia be closer?,https://www.bbc.co.uk/news/articles/cgjp7vpee03o
2026-05-03 05:21:54 UTC,5,"From beds to LED masks, is the red light craze giving us more than just a warm glow?",https://www.bbc.co.uk/news/articles/c2lw59jrdkxo
2026-05-03 05:21:54 UTC,6,What death doulas can teach us about dying,https://www.bbc.co.uk/news/articles/cp9vp0ld1leo
2026-05-03 05:21:54 UTC,7,Man charged with murder and sexual assault of 5-year-old Australian girl,https://www.bbc.co.uk/news/articles/cy92qennznjo
2026-05-03 05:21:54 UTC,8,Germany says US troop withdrawal 'foreseeable' as Trump warns of more 'cuts',https://www.bbc.co.uk/news/articles/cd9pn541jjlo
2026-05-03 05:21:54 UTC,9,Musk's AI told me people were coming to kill me. I grabbed a hammer and prepared for war,https://www.bbc.co.uk/news/articles/c242pzr1zp2o
2026-05-03 05:21:54 UTC,10,Laufey on making jazz cool again (and the fish that brought out her inner rage),https://www.bbc.co.uk/news/articles/c99lvggdy4jo
