timestamp,rank,title,link
2025-09-26 00:49:22 UTC,1,Ex-Arsenal youth striker dies after injury during game,https://www.bbc.co.uk/news/articles/cq5jye4v64no
2025-09-26 00:49:22 UTC,2,Starmer to announce plans for digital ID scheme,https://www.bbc.co.uk/news/articles/c4g54g6vgpdo
2025-09-26 00:49:22 UTC,3,Which areas are due to get share of £5bn funding boost?,https://www.bbc.co.uk/news/articles/c1mx8vr2gr1o
2025-09-26 00:49:22 UTC,4,Samaritans facing volunteer exodus over proposed branch closures,https://www.bbc.co.uk/news/articles/c931w38kdqwo
2025-09-26 00:49:22 UTC,5,PM compares Burnham's economic proposals to Truss 'disaster',https://www.bbc.co.uk/news/articles/cly0n24k04ro
2025-09-26 00:49:22 UTC,6,Ratmageddon: Why rats are overrunning our cities,https://www.bbc.co.uk/news/articles/c4gvk397j80o
2025-09-26 00:49:22 UTC,7,Emma Watson says she still loves JK Rowling despite rift over trans views,https://www.bbc.co.uk/news/articles/c4gvp18xe17o
2025-09-26 00:49:22 UTC,8,PM defends mayor against 'ridiculous' Trump claims,https://www.bbc.co.uk/news/articles/c147vd511djo
2025-09-26 00:49:22 UTC,9,"Million-year-old skull rewrites human evolution, scientists claim",https://www.bbc.co.uk/news/articles/cdx01ve5151o
2025-09-26 00:49:22 UTC,10,'Film me all you want' - teenage girls with no fear of police torment one High Street,https://www.bbc.co.uk/news/articles/c0q751vlxw1o
