timestamp,position,title,link
2026-06-07 02:44:52 UTC,1,"Delays to defence plan undermine UK credibility, MPs say",https://www.bbc.co.uk/news/articles/c0ky47v6d1no
2026-06-07 02:44:52 UTC,2,Starmer tells supporters he will fight any leadership contest,https://www.bbc.co.uk/news/articles/c3vyxzl625po
2026-06-07 02:44:52 UTC,3,Cosmeticorexia: How girls are falling down a skincare rabbit hole,https://www.bbc.co.uk/news/articles/cx212x41evwo
2026-06-07 02:44:52 UTC,4,Police officer turned Love Island US contestant faces hometown backlash,https://www.bbc.co.uk/news/articles/cpqprxlqe0po
2026-06-07 02:44:52 UTC,5,Hegseth attacks Europe over migration with beach 'invasion' D-Day speech,https://www.bbc.co.uk/news/articles/c802e7jk458o
2026-06-07 02:44:52 UTC,6,Lebanese general among three soldiers killed in Israeli attack on car,https://www.bbc.co.uk/news/articles/cj0g8jymg92o
2026-06-07 02:44:52 UTC,7,"Watch: A veil, gowns and umbrellas at a rainy royal wedding. Video, 00:01:03Watch: A veil, gowns and umbrellas at a rainy royal wedding",https://www.bbc.co.uk/news/videos/cn8q7v27pw0o
2026-06-07 02:44:52 UTC,8,"Delays to defence plan undermine UK credibility, MPs say",https://www.bbc.co.uk/news/articles/c0ky47v6d1no
2026-06-07 02:44:52 UTC,9,Starmer tells supporters he will fight any leadership contest,https://www.bbc.co.uk/news/articles/c3vyxzl625po
2026-06-07 02:44:52 UTC,10,Cosmeticorexia: How girls are falling down a skincare rabbit hole,https://www.bbc.co.uk/news/articles/cx212x41evwo
