timestamp,position,title,link
2026-04-15 01:23:54 UTC,1,Trump hints Iran talks could resume this week as US maritime blockade continues,https://www.bbc.co.uk/news/articles/c20ddnz4w5lo
2026-04-15 01:23:54 UTC,2,"UK faces biggest hit to growth from Iran war of major economies, IMF says",https://www.bbc.co.uk/news/articles/c3v670qwz97o
2026-04-15 01:23:54 UTC,3,"Help to Buy mostly helped high earners, IFS says",https://www.bbc.co.uk/news/articles/cy511kd5lkwo
2026-04-15 01:23:54 UTC,4,"King not meeting Epstein survivors, but state visit could help ease US-UK tensions",https://www.bbc.co.uk/news/articles/cvg44q1zdeno
2026-04-15 01:23:54 UTC,5,'I'm not being listened to' - new health plan launched as women say they are still ignored,https://www.bbc.co.uk/news/articles/cm2kke1jn8xo
2026-04-15 01:23:54 UTC,6,Butterfly numbers are dropping but here are five species you may see more of,https://www.bbc.co.uk/news/articles/c75kk7p41npo
2026-04-15 01:23:54 UTC,7,"'Welcome home': Watch joyful reunion as Orion capsule opened after splashdown. Video, 00:00:59'Welcome home': Watch joyful reunion as Orion capsule opened after splashdown",https://www.bbc.co.uk/news/videos/clyxxnz97wxo
2026-04-15 01:23:54 UTC,8,Woman asked to leave bar after wheelchair deemed a 'safety risk',https://www.bbc.co.uk/news/articles/c04xx7wkg4xo
2026-04-15 01:23:54 UTC,9,Number of asylum hotels falls to 185 after 11 close,https://www.bbc.co.uk/news/articles/c4gllpll2rno
2026-04-15 01:23:54 UTC,10,"US-Kuwaiti journalist detained in Kuwait after social media posts, watchdog says",https://www.bbc.co.uk/news/articles/cx2dd0lz1m2o
