timestamp,position,title,link
2025-10-31 00:52:51 UTC,1,Andrew stripped of 'prince' title and will move out of Royal Lodge,https://www.bbc.co.uk/news/articles/cr7m4yjkp74o
2025-10-31 00:52:51 UTC,2,Is this finally rock bottom for Mr Andrew Mountbatten Windsor?,https://www.bbc.co.uk/news/articles/c62elnjnqqxo
2025-10-31 00:52:51 UTC,3,Letting agent apologises for 'oversight' on Reeves rental licence,https://www.bbc.co.uk/news/articles/cx2p55ejy88o
2025-10-31 00:52:51 UTC,4,What the Reeves emails tell us in rental licence row,https://www.bbc.co.uk/news/articles/cj41y1ze9jyo
2025-10-31 00:52:51 UTC,5,'We saw people murdered in front of us' - Sudan siege survivors speak to the BBC,https://www.bbc.co.uk/news/articles/cgr4qqgdlkjo
2025-10-31 00:52:51 UTC,6,England's most deprived areas named - see how yours is affected,https://www.bbc.co.uk/news/articles/cly137089yyo
2025-10-31 00:52:51 UTC,7,"Trump caps US refugee admissions at 7,500 - mostly white South Africans",https://www.bbc.co.uk/news/articles/cy40jj71243o
2025-10-31 00:52:51 UTC,8,Man dies and three injured in helicopter crash,https://www.bbc.co.uk/news/articles/cx203g3j416o
2025-10-31 00:52:51 UTC,9,"'Everything's gone' - BBC finally able to access one of Jamaica's worst-hit areas. Video, 00:01:50'Everything's gone' - BBC finally able to access one of Jamaica's worst-hit areas",https://www.bbc.co.uk/news/videos/c4gj9j66wxno
2025-10-31 00:52:51 UTC,10,Health officials worried as flu season comes five weeks early,https://www.bbc.co.uk/news/articles/c20pe6llg2zo
