timestamp,rank,title,link
2026-02-04 01:07:46 UTC,1,Andrew moves out of Royal Lodge home,https://www.bbc.co.uk/news/articles/c8e5zgprgn1o
2026-02-04 01:07:46 UTC,2,'Bus driver who punched thief made me feel safe',https://www.bbc.co.uk/news/articles/c4gv196jn30o
2026-02-04 01:07:46 UTC,3,Chappell Roan says revealing Grammys outfit wasn't 'that outrageous',https://www.bbc.co.uk/news/articles/cx2w3ldex3no
2026-02-04 01:07:46 UTC,4,Sarah Ferguson emails to Epstein show increasing desperation,https://www.bbc.co.uk/news/articles/cpdyg117gl2o
2026-02-04 01:07:46 UTC,5,Thousands of Epstein documents taken down after victims identified,https://www.bbc.co.uk/news/articles/cn0k65pnxjxo
2026-02-04 01:07:46 UTC,6,Police assess allegation Epstein sent second woman to UK for sex with Andrew,https://www.bbc.co.uk/news/articles/cp3zg9g3v4lo
2026-02-04 01:07:46 UTC,7,"Two men killed in light aircraft crash, police say",https://www.bbc.co.uk/news/articles/c931zxwkqpyo
2026-02-04 01:07:46 UTC,8,Trial of Norway crown princess's son hears tearful account in rape trial,https://www.bbc.co.uk/news/articles/cdx43rxgyk1o
2026-02-04 01:07:46 UTC,9,Police investigate Mandelson over claims he leaked information to Epstein,https://www.bbc.co.uk/news/articles/cre2yqyex4zo
2026-02-04 01:07:46 UTC,10,"'I don't think I am a hero': Boy, 13, describes 'superhuman' swim to save family",https://www.bbc.co.uk/news/articles/cly3ezj3rg3o
