timestamp,position,title,link
2026-04-24 01:30:08 UTC,1,Trump tells BBC that King's visit could 'absolutely' help repair relations with UK,https://www.bbc.co.uk/news/articles/cx2wdegnzzjo
2026-04-24 01:30:08 UTC,2,Assisted dying bill to run out of time as Lords hold final debate,https://www.bbc.co.uk/news/articles/cgk0vz5e2zxo
2026-04-24 01:30:08 UTC,3,Ringo Starr: 'I made all my mistakes on stage',https://www.bbc.co.uk/news/articles/cp8645d9lvyo
2026-04-24 01:30:08 UTC,4,"Trump says Israel-Lebanon ceasefire extended by three weeks, but he won't 'rush' Iran deal",https://www.bbc.co.uk/news/live/c0mjev4kn9jt
2026-04-24 01:30:08 UTC,5,"Stock markets are too high and set to fall, says Bank of England deputy",https://www.bbc.co.uk/news/articles/c75kp1y43lgo
2026-04-24 01:30:08 UTC,6,Southport dads: 'Running for our girls has made us like brothers',https://www.bbc.co.uk/news/articles/cj37d4gzz4xo
2026-04-24 01:30:08 UTC,7,PM's ex-chief of staff says he doesn't recognise claims about his behaviour,https://www.bbc.co.uk/news/articles/cy01r3jedgdo
2026-04-24 01:30:08 UTC,8,"US soldier charged after winning $400,000 betting on removal of Maduro",https://www.bbc.co.uk/news/articles/c20832yg5p2o
2026-04-24 01:30:08 UTC,9,Huge chunk of glacier blocks Everest route in peak climbing season,https://www.bbc.co.uk/news/articles/cy81lrnv5peo
2026-04-24 01:30:08 UTC,10,"Proxy attacks in UK a real and growing concern, says PM",https://www.bbc.co.uk/news/articles/clyxlnzrq41o
2026-04-24 04:46:50 UTC,1,"Trump says Israel-Lebanon ceasefire extended by three weeks, but he won't 'rush' Iran deal",https://www.bbc.co.uk/news/live/c0mjev4kn9jt
2026-04-24 04:46:50 UTC,2,Trump tells BBC that King's visit could 'absolutely' help repair relations with UK,https://www.bbc.co.uk/news/articles/cx2wdegnzzjo
2026-04-24 04:46:50 UTC,3,"Stock markets are too high and set to fall, says Bank of England deputy",https://www.bbc.co.uk/news/articles/c75kp1y43lgo
2026-04-24 04:46:50 UTC,4,Assisted dying bill to run out of time as Lords hold final debate,https://www.bbc.co.uk/news/articles/cgk0vz5e2zxo
2026-04-24 04:46:50 UTC,5,Ringo Starr: 'I made all my mistakes on stage',https://www.bbc.co.uk/news/articles/cp8645d9lvyo
2026-04-24 04:46:50 UTC,6,"US soldier charged after winning $400,000 betting on removal of Maduro",https://www.bbc.co.uk/news/articles/c20832yg5p2o
2026-04-24 04:46:50 UTC,7,Southport dads: 'Running for our girls has made us like brothers',https://www.bbc.co.uk/news/articles/cj37d4gzz4xo
2026-04-24 04:46:50 UTC,8,Littler cuts gap to Clayton with win in Liverpool,https://www.bbc.co.uk/sport/darts/articles/cx2v3g2qyx7o
2026-04-24 04:46:50 UTC,9,"Singer D4vd had 'significant amount' of child sex abuse images when arrested, prosecutors say",https://www.bbc.co.uk/news/articles/cn53vg3y574o
2026-04-24 04:46:50 UTC,10,PM's ex-chief of staff says he doesn't recognise claims about his behaviour,https://www.bbc.co.uk/news/articles/cy01r3jedgdo
