timestamp,rank,title,link
2025-12-07 01:00:53 UTC,1,King and Queen reveal this year's Christmas card,https://www.bbc.co.uk/news/articles/c3e0nlplyy3o
2025-12-07 01:00:53 UTC,2,Young people on benefits to be offered construction and hospitality work,https://www.bbc.co.uk/news/articles/cqlke33rzplo
2025-12-07 01:00:53 UTC,3,Sold 30 items on Vinted? Don't panic if you get a message about tax,https://www.bbc.co.uk/news/articles/c0mxe7l7wp1o
2025-12-07 01:00:53 UTC,4,"Staff and tourists among 23 killed in Goa nightclub fire, officials say",https://www.bbc.co.uk/news/articles/cdj82d0nd4eo
2025-12-07 01:00:53 UTC,5,Zelensky signals progress in talks with US on peace plan,https://www.bbc.co.uk/news/articles/cz680jx511no
2025-12-07 01:00:53 UTC,6,"Can you ban kids from social media? Australia is about to, but some teens are a step ahead",https://www.bbc.co.uk/news/articles/crk7xgzj8y8o
2025-12-07 01:00:53 UTC,7,Netflix deal puts Gary Lineker in podcast super league - but can he succeed?,https://www.bbc.co.uk/news/articles/c773vvmr5peo
2025-12-07 01:00:53 UTC,8,Veteran who stopped XL bully attack shocked by owner's sentence,https://www.bbc.co.uk/news/articles/clydq2r0ly5o
2025-12-07 01:00:53 UTC,9,Four arrested after crumble and custard thrown at Crown Jewels display,https://www.bbc.co.uk/news/articles/cpd61w22e3no
2025-12-07 01:00:53 UTC,10,Met Office issues weather warning for rain,https://www.bbc.co.uk/news/articles/c0mp8dyg2xyo
