timestamp,rank,title,link
2026-06-27 02:09:17 UTC,1,Meloni and Trump: A very public fall-out that is proving very hard to fix,https://www.bbc.co.uk/news/articles/cze962pgk27o
2026-06-27 02:09:17 UTC,2,US conducts strikes on Iran after attack on cargo ship,https://www.bbc.co.uk/news/articles/ckg590wqxwpo
2026-06-27 02:09:17 UTC,3,Home Office to introduce new asylum routes to UK,https://www.bbc.co.uk/news/articles/c5yz952dm74o
2026-06-27 02:09:17 UTC,4,Madonna was 'jealous of Kylie' - and more things we learned in her Graham Norton interview,https://www.bbc.co.uk/news/articles/cn07rpn0rkxo
2026-06-27 02:09:17 UTC,5,Three unusual things about the King's tax bill,https://www.bbc.co.uk/news/articles/ce8kg7zg09ko
2026-06-27 02:09:17 UTC,6,'Burnham election call' and 'Too hot for tennis',https://www.bbc.co.uk/news/articles/c3ey093d039o
2026-06-27 02:09:17 UTC,7,Trump threatens 100% tariff on European nations over tech tax,https://www.bbc.co.uk/news/articles/cn4rd71411ko
2026-06-27 02:09:17 UTC,8,Harry and Meghan accept offer to stay at royal estate during UK visit,https://www.bbc.co.uk/news/articles/cdjk8gggnndo
2026-06-27 02:09:17 UTC,9,Hottest June day record broken for third day in row as temperature hits 37.3C,https://www.bbc.co.uk/news/articles/cn4d0n1l8zno
2026-06-27 02:09:17 UTC,10,How messages between two dads helped expose the largest NHS maternity scandal,https://www.bbc.co.uk/news/articles/cd7pqqzznevo
