timestamp,rank,title,link
2026-05-24 02:10:06 UTC,1,"Spurred on by the painful death of her dad, Natalie Cassidy trains as a carer",https://www.bbc.co.uk/news/articles/c70v1yy9nn1o
2026-05-24 02:10:06 UTC,2,Trump says Iran deal 'largely negotiated' including reopening Strait of Hormuz,https://www.bbc.co.uk/news/articles/crmp121z3z8o
2026-05-24 02:10:06 UTC,3,'Six eggs used to be £1' - why everyday essentials cost so much more now,https://www.bbc.co.uk/news/articles/cd6pw4zg5p9o
2026-05-24 02:10:06 UTC,4,Midnight Sun-derland: Zara Larsson electrifies the crowd at Big Weekend,https://www.bbc.co.uk/news/articles/c4g07gdzneno
2026-05-24 02:10:06 UTC,5,Rosenberg: Luhansk strike sparks Russian accusations and vow to retaliate,https://www.bbc.co.uk/news/articles/cvgz05jyrrpo
2026-05-24 02:10:06 UTC,6,It's like the Olympics - except steroids are allowed,https://www.bbc.co.uk/news/articles/cedpz1zqp8po
2026-05-24 02:10:06 UTC,7,"'Shameful' more spent on benefits than jobs for young people, says Milburn",https://www.bbc.co.uk/news/articles/crrpx4p1z71o
2026-05-24 02:10:06 UTC,8,New James Bond game shows more vulnerable side to iconic British spy,https://www.bbc.co.uk/news/articles/cvgzdr177mvo
2026-05-24 02:10:06 UTC,9,France suspends extra EU border checks at Dover after hours-long queues,https://www.bbc.co.uk/news/articles/cp3p2ver9k6o
2026-05-24 02:10:06 UTC,10,Pony rescued from inside tractor tyre,https://www.bbc.co.uk/news/articles/c5yr5xy1v0ro
