timestamp,position,title,link
2026-05-14 02:08:53 UTC,1,Starmer warns leadership contest would 'plunge us into chaos' in pleas to ministers and MPs,https://www.bbc.co.uk/news/articles/cvgzv4eqdrno
2026-05-14 02:08:53 UTC,2,Chris Mason: Big moment ahead for Streeting to decide whether to go for it,https://www.bbc.co.uk/news/articles/c392djn3zzdo
2026-05-14 02:08:53 UTC,3,Hezbollah support endures in south Lebanon as ceasefire fails to stop war with Israel,https://www.bbc.co.uk/news/articles/c9d3g6deljyo
2026-05-14 02:08:53 UTC,4,Trump and Xi shake hands on red carpet ahead of high-stakes meeting in Beijing,https://www.bbc.co.uk/news/live/cvgz8qverzqt
2026-05-14 02:08:53 UTC,5,"Why is Donald Trump in China? BBC explains. Video, 00:01:11Why is Donald Trump in China? BBC explains",https://www.bbc.co.uk/news/videos/clypvn70783o
2026-05-14 02:08:53 UTC,6,"Higher Europe air fares 'inevitable', says industry head",https://www.bbc.co.uk/news/articles/clyprnelzxzo
2026-05-14 02:08:53 UTC,7,"'When the school bell goes, it's fight or flight' - the PTSD faced by NI's prison guards",https://www.bbc.co.uk/news/articles/cj3pjk0vjjpo
2026-05-14 02:08:53 UTC,8,Harry warns of 'deeply troubling' rise in antisemitism in UK,https://www.bbc.co.uk/news/articles/c8xw55q0elvo
2026-05-14 02:08:53 UTC,9,Car showroom owner 'heartbroken' after vehicles destroyed by fire,https://www.bbc.co.uk/news/articles/c86d09l7v49o
2026-05-14 02:08:53 UTC,10,Bodies of three young women pulled from sea off Brighton,https://www.bbc.co.uk/news/articles/c0e29n94ze4o
2026-05-14 06:14:50 UTC,1,"Rayner 'cleared' over tax affairs, paving way for any leadership bid, as Streeting expected to challenge PM",https://www.bbc.co.uk/news/live/cwy21gpr1kzt
2026-05-14 06:14:50 UTC,2,Chris Mason: Big moment ahead for Streeting to decide whether to go for it,https://www.bbc.co.uk/news/articles/c392djn3zzdo
2026-05-14 06:14:50 UTC,3,'I've been exonerated': Angela Rayner says HMRC has cleared her over flat stamp duty,https://www.bbc.co.uk/news/articles/cx219y4qy0qo
2026-05-14 06:14:50 UTC,4,UK economy grows by 0.6% in first three months of the year,https://www.bbc.co.uk/news/live/cx21nlg7eylt
2026-05-14 06:14:50 UTC,5,Trump calls high-stakes talks with Xi 'great' as China throws spectacular welcome,https://www.bbc.co.uk/news/live/cvgz8qverzqt
2026-05-14 06:14:50 UTC,6,Warning higher Europe air fares 'inevitable' due to Iran war,https://www.bbc.co.uk/news/articles/clyprnelzxzo
2026-05-14 06:14:50 UTC,7,"'When the school bell goes, it's fight or flight' - the PTSD faced by NI's prison guards",https://www.bbc.co.uk/news/articles/cj3pjk0vjjpo
2026-05-14 06:14:50 UTC,8,Hezbollah support endures in south Lebanon as ceasefire fails to stop war with Israel,https://www.bbc.co.uk/news/articles/c9d3g6deljyo
2026-05-14 06:14:50 UTC,9,Car showroom owner 'heartbroken' after vehicles destroyed by fire,https://www.bbc.co.uk/news/articles/c86d09l7v49o
2026-05-14 06:14:50 UTC,10,"Met Police prepares armoured vehicles and 4,000 officers for dual London protests",https://www.bbc.co.uk/news/articles/c172n5e0prko
2026-05-14 09:25:53 UTC,1,"Chancellor warns leadership contest would cause 'chaos', as Rayner says she has been cleared over tax affairs",https://www.bbc.co.uk/news/live/cwy21gpr1kzt
2026-05-14 09:25:53 UTC,2,Chris Mason: Potential leadership challengers jostle for position,https://www.bbc.co.uk/news/articles/c232pz403dko
2026-05-14 09:25:53 UTC,3,UK economy sees surprise growth in March despite Iran war,https://www.bbc.co.uk/news/articles/cx213n20njzo
2026-05-14 09:25:53 UTC,4,Trump calls high-stakes talks with Xi 'great' as Beijing again warns US over Taiwan,https://www.bbc.co.uk/news/live/cvgz8qverzqt
2026-05-14 09:25:53 UTC,5,"Watch: What happened on day one of Trump's China visit? Video, 00:00:57Watch: What happened on day one of Trump's China visit?",https://www.bbc.co.uk/news/videos/c707xn4ew3po
2026-05-14 09:25:53 UTC,6,Hezbollah support endures in south Lebanon as ceasefire fails to stop war with Israel,https://www.bbc.co.uk/news/articles/c9d3g6deljyo
2026-05-14 09:25:53 UTC,7,'I was given a choice - keep my legs or keep my life' - the sepsis patient who lived,https://www.bbc.co.uk/news/articles/cgjp2w03v10o
2026-05-14 09:25:53 UTC,8,"Madonna, Shakira & BTS to headline World Cup half-time show",https://www.bbc.co.uk/sport/football/articles/c5yrl54561do
2026-05-14 09:25:53 UTC,9,Car showroom owner 'heartbroken' after vehicles destroyed by fire,https://www.bbc.co.uk/news/articles/c86d09l7v49o
2026-05-14 09:25:53 UTC,10,Mother of Nottingham triple killer begins giving evidence to public inquiry,https://www.bbc.co.uk/news/live/c042rxlwn5vt
