timestamp,rank,title,link
2026-02-16 01:13:15 UTC,1,Bondi criticised after saying all Epstein files have been released,https://www.bbc.co.uk/news/articles/cz7genjx9njo
2026-02-16 01:13:15 UTC,2,Delivery van 'stuck on deadliest mudflat footpath',https://www.bbc.co.uk/news/articles/cn9e32yv9g5o
2026-02-16 01:13:15 UTC,3,FBI analysing recovered glove that appears to match those worn in Guthrie suspect video,https://www.bbc.co.uk/news/articles/c5yrv2g16e2o
2026-02-16 01:13:15 UTC,4,Ukraine's ex-energy minister detained while attempting to leave country,https://www.bbc.co.uk/news/articles/c4g5380xwqjo
2026-02-16 01:13:15 UTC,5,"Andrew's time as trade envoy should be investigated, says Vince Cable",https://www.bbc.co.uk/news/articles/cp32j7v2dy5o
2026-02-16 01:13:15 UTC,6,What is the dart frog toxin allegedly used to kill Alexei Navalny?,https://www.bbc.co.uk/news/articles/cm289we7jzdo
2026-02-16 01:13:15 UTC,7,'Trump will be gone in three years': Top Democrats try to reassure Europe,https://www.bbc.co.uk/news/articles/cjrq2r9y278o
2026-02-16 01:13:15 UTC,8,"No free pass for internet platforms on child safety, Starmer says",https://www.bbc.co.uk/news/articles/cvg38x13x5yo
2026-02-16 01:13:15 UTC,9,Hundreds of thousands join Iran protests around the world,https://www.bbc.co.uk/news/articles/czr0lykl4g4o
2026-02-16 01:13:15 UTC,10,"UK wants action taken on Russia after Navalny frog poisoning, Cooper says",https://www.bbc.co.uk/news/articles/c8r15e4ek2vo
2026-02-16 04:13:24 UTC,1,Bondi criticised after saying all Epstein files have been released,https://www.bbc.co.uk/news/articles/cz7genjx9njo
2026-02-16 04:13:24 UTC,2,'Truth is antidote to Putin's poison' and 'Europe sabotage campaign',https://www.bbc.co.uk/news/articles/c5yqvqw12p0o
2026-02-16 04:13:24 UTC,3,UK considering significant increase to defence spending,https://www.bbc.co.uk/news/articles/cpqwl10lvr2o
2026-02-16 04:13:24 UTC,4,Cabinet secretary frontrunner previously spoken to about management style,https://www.bbc.co.uk/news/articles/cpqwlwndj9yo
2026-02-16 04:13:24 UTC,5,Ministers want to reform SEND - but they are treading very carefully,https://www.bbc.co.uk/news/articles/c7951dzg9npo
2026-02-16 04:13:24 UTC,6,FBI analysing recovered glove that appears to match those worn in Guthrie suspect video,https://www.bbc.co.uk/news/articles/c5yrv2g16e2o
2026-02-16 04:13:24 UTC,7,The £10 tricks I used to make my rented room into a home,https://www.bbc.co.uk/news/articles/cx2g1k8enleo
2026-02-16 04:13:24 UTC,8,Ukraine's ex-energy minister detained while attempting to leave country,https://www.bbc.co.uk/news/articles/c4g5380xwqjo
2026-02-16 04:13:24 UTC,9,Ex-church minister who admitted child sexual abuse to BBC still free years later,https://www.bbc.co.uk/news/articles/cx2k23mlkzlo
2026-02-16 04:13:24 UTC,10,"No free pass for internet platforms on child safety, Starmer says",https://www.bbc.co.uk/news/articles/cvg38x13x5yo
