timestamp,rank,title,link
2026-02-19 01:13:44 UTC,1,"Do not give away Diego Garcia, Trump tells UK in fresh attack on Chagos deal",https://www.bbc.co.uk/news/articles/c309qqyer8yo
2026-02-19 01:13:44 UTC,2,"Teenage girls lured into forced sex by gangs in London, BBC finds",https://www.bbc.co.uk/news/articles/cjd9xnjyy8po
2026-02-19 01:13:44 UTC,3,Eight skiers found dead after California avalanche,https://www.bbc.co.uk/news/articles/cvg19dp4vxgo
2026-02-19 01:13:44 UTC,4,How a fatal crash happened on a smart motorway,https://www.bbc.co.uk/news/articles/c4g2d4l1x15o
2026-02-19 01:13:44 UTC,5,Billionaire Les Wexner tells US lawmakers he was 'naive' and 'conned' by Epstein,https://www.bbc.co.uk/news/articles/cy57rrrpvg7o
2026-02-19 01:13:44 UTC,6,'Trump pulls support for Chagos' and 'Britain faces '1936 moment'',https://www.bbc.co.uk/news/articles/cx2l5n096eko
2026-02-19 01:13:44 UTC,7,Farmer Tony Martin leaves £2.5m to 'loyal friend',https://www.bbc.co.uk/news/articles/cvg19m8p782o
2026-02-19 01:13:44 UTC,8,Zuckerberg defends Meta in landmark social media addiction trial,https://www.bbc.co.uk/news/articles/c5y42znjnjvo
2026-02-19 01:13:44 UTC,9,Tech firms will have 48 hours to remove abusive images under new law,https://www.bbc.co.uk/news/articles/cz6ed1549yvo
2026-02-19 01:13:44 UTC,10,"Vinicius: Eight years at Real Madrid, 20 cases of alleged racist abuse",https://www.bbc.co.uk/sport/football/articles/c4g82mr3l3vo
