timestamp,rank,title,link
2026-02-11 01:20:57 UTC,1,Ex-police chief said Trump told him in 2006 'everyone' knew of Epstein's behaviour,https://www.bbc.co.uk/news/articles/cx2407jrn83o
2026-02-11 01:20:57 UTC,2,Boy arrested for attempted murder after two pupils stabbed at school,https://www.bbc.co.uk/news/articles/cge8yxpj7e1o
2026-02-11 01:20:57 UTC,3,'Fear and alienation': Senior Co-op staff complain of 'toxic' culture at the top,https://www.bbc.co.uk/news/articles/crrnkpyqdzyo
2026-02-11 01:20:57 UTC,4,Dad shot daughter after 'arguing about Donald Trump',https://www.bbc.co.uk/news/articles/cwyk917xy8no
2026-02-11 01:20:57 UTC,5,FBI releases images of masked person in hunt for Savannah Guthrie's mother,https://www.bbc.co.uk/news/articles/cy4wdgxr081o
2026-02-11 01:20:57 UTC,6,Captivating chemistry or a hollow misfire? Wuthering Heights splits critics,https://www.bbc.co.uk/news/articles/c3wl6vezydeo
2026-02-11 01:20:57 UTC,7,Sanctions-busting shadow ships are increasing - the big question is what to do about them,https://www.bbc.co.uk/news/articles/c07jnmgy8jmo
2026-02-11 01:20:57 UTC,8,"I will never walk away, says PM after facing pressure to quit",https://www.bbc.co.uk/news/articles/c20j65ldg9zo
2026-02-11 01:20:57 UTC,9,Former Daily Mail editor tells hacking trial allegations are 'preposterous',https://www.bbc.co.uk/news/articles/cy03g54946ko
2026-02-11 01:20:57 UTC,10,Spike in antisemitism reports after synagogue attack,https://www.bbc.co.uk/news/articles/cjd95r4lyvko
2026-02-11 04:21:31 UTC,1,'Terror probe into stabbing' and 'Streeting still intent',https://www.bbc.co.uk/news/articles/c78xdqd07e2o
2026-02-11 04:21:31 UTC,2,'Fear and alienation': Senior Co-op staff complain of 'toxic' culture at the top,https://www.bbc.co.uk/news/articles/crrnkpyqdzyo
2026-02-11 04:21:31 UTC,3,US lawmakers urge Andrew to testify over Epstein files,https://www.bbc.co.uk/news/articles/cx2gmde0vjlo
2026-02-11 04:21:31 UTC,4,Boy arrested for attempted murder after two pupils stabbed at school,https://www.bbc.co.uk/news/articles/cge8yxpj7e1o
2026-02-11 04:21:31 UTC,5,Ex-police chief said Trump told him in 2006 'everyone' knew of Epstein's behaviour,https://www.bbc.co.uk/news/articles/cx2407jrn83o
2026-02-11 04:21:31 UTC,6,UK doubles troops in Norway to counter Russian 'threat to Arctic',https://www.bbc.co.uk/news/articles/ce94jm1pp5xo
2026-02-11 04:21:31 UTC,7,Sanctions-busting shadow ships are increasing - the big question is what to do about them,https://www.bbc.co.uk/news/articles/c07jnmgy8jmo
2026-02-11 04:21:31 UTC,8,Are wetter winters and frequent flooding here to stay?,https://www.bbc.co.uk/news/articles/cvgjw0kpd89o
2026-02-11 04:21:31 UTC,9,Former Daily Mail editor tells hacking trial allegations are 'preposterous',https://www.bbc.co.uk/news/articles/cy03g54946ko
2026-02-11 04:21:31 UTC,10,Dad shot daughter after 'arguing about Donald Trump',https://www.bbc.co.uk/news/articles/cwyk917xy8no
2026-02-11 06:02:34 UTC,1,'Terror probe into stabbing' and 'Streeting still intent',https://www.bbc.co.uk/news/articles/c78xdqd07e2o
2026-02-11 06:02:34 UTC,2,'Fear and alienation': Senior Co-op staff complain of 'toxic' culture at the top,https://www.bbc.co.uk/news/articles/crrnkpyqdzyo
2026-02-11 06:02:34 UTC,3,UK doubles troops in Norway to counter Russian 'threat to Arctic',https://www.bbc.co.uk/news/articles/ce94jm1pp5xo
2026-02-11 06:02:34 UTC,4,Boy arrested for attempted murder after two pupils stabbed at school,https://www.bbc.co.uk/news/articles/cge8yxpj7e1o
2026-02-11 06:02:34 UTC,5,Ex-police chief said Trump told him in 2006 'everyone' knew of Epstein's behaviour,https://www.bbc.co.uk/news/articles/cx2407jrn83o
2026-02-11 06:02:34 UTC,6,US lawmakers tell BBC Andrew should testify over Epstein files,https://www.bbc.co.uk/news/articles/cx2gmde0vjlo
2026-02-11 06:02:34 UTC,7,Sanctions-busting shadow ships are increasing - the big question is what to do about them,https://www.bbc.co.uk/news/articles/c07jnmgy8jmo
2026-02-11 06:02:34 UTC,8,Chris Mason: Smiles of a survivor as Starmer attempts his latest reset,https://www.bbc.co.uk/news/articles/czj198mk0l8o
2026-02-11 06:02:34 UTC,9,How a TV journalist helped crack a murder cold case,https://www.bbc.co.uk/news/articles/c8xyedpqvrko
2026-02-11 06:02:34 UTC,10,Are wetter winters and frequent flooding here to stay?,https://www.bbc.co.uk/news/articles/cvgjw0kpd89o
