timestamp,rank,title,link
2026-05-11 02:05:03 UTC,1,Trump calls Iran response to US proposal to end war 'totally unacceptable',https://www.bbc.co.uk/news/articles/clypgz9e5pmo
2026-05-11 02:05:03 UTC,2,How hotels are stopping the 'dawn dash' for sunbeds after man wins payout,https://www.bbc.co.uk/news/articles/c99l17m2ep9o
2026-05-11 02:05:03 UTC,3,Adolescence makes history at Bafta TV Awards,https://www.bbc.co.uk/news/articles/c5y76dll19po
2026-05-11 02:05:03 UTC,4,'Labour leadership rivals circle' and 'Golden boys' on Baftas red carpet,https://www.bbc.co.uk/news/articles/cz623e3d06do
2026-05-11 02:05:03 UTC,5,Why Eurovision's fallout over Israel may change the competition forever,https://www.bbc.co.uk/news/articles/cgkpgm6vk48o
2026-05-11 02:05:03 UTC,6,Starmer to promise bolder action as leadership threats mount,https://www.bbc.co.uk/news/articles/cjwpq1dg5q3o
2026-05-11 02:05:03 UTC,7,New laws expected to be in the King's Speech,https://www.bbc.co.uk/news/articles/c2324yp7ygyo
2026-05-11 02:05:03 UTC,8,"British passengers from hantavirus-hit cruise ship isolating in hospital, says UKHSA",https://www.bbc.co.uk/news/articles/c4g83vddnz0o
2026-05-11 02:05:03 UTC,9,His father had just been buried. Then West Bank settlers forced him to dig up the body,https://www.bbc.co.uk/news/articles/cjrpnjpl39po
2026-05-11 02:05:03 UTC,10,Chris Mason: Another crunch moment for Starmer as he pleads with Labour MPs not to topple him,https://www.bbc.co.uk/news/articles/cevp4kr79e4o
2026-05-11 06:27:55 UTC,1,Tourist hotspot at 'end of the world' denies causing hantavirus outbreak,https://www.bbc.co.uk/news/articles/cx21ej471g2o
2026-05-11 06:27:55 UTC,2,How hotels are stopping the 'dawn dash' for sunbeds after man wins payout,https://www.bbc.co.uk/news/articles/c99l17m2ep9o
2026-05-11 06:27:55 UTC,3,Adolescence makes history at Bafta TV Awards,https://www.bbc.co.uk/news/articles/c5y76dll19po
2026-05-11 06:27:55 UTC,4,Trump calls Iran response to US proposal to end war 'totally unacceptable',https://www.bbc.co.uk/news/articles/clypgz9e5pmo
2026-05-11 06:27:55 UTC,5,'Labour leadership rivals circle' and 'Golden boys' on Baftas red carpet,https://www.bbc.co.uk/news/articles/cz623e3d06do
2026-05-11 06:27:55 UTC,6,Why Eurovision's fallout over Israel may change the competition forever,https://www.bbc.co.uk/news/articles/cgkpgm6vk48o
2026-05-11 06:27:55 UTC,7,British passengers from hantavirus-hit cruise ship isolating in hospital,https://www.bbc.co.uk/news/articles/c4g83vddnz0o
2026-05-11 06:27:55 UTC,8,"This couple lost £1,000 after their flight was cancelled - here is what to check so you don't",https://www.bbc.co.uk/news/articles/cx215yldr13o
2026-05-11 06:27:55 UTC,9,New laws expected to be in the King's Speech,https://www.bbc.co.uk/news/articles/c2324yp7ygyo
2026-05-11 06:27:55 UTC,10,Chris Mason: Another crunch moment for Starmer as he pleads with Labour MPs not to topple him,https://www.bbc.co.uk/news/articles/cevp4kr79e4o
2026-05-11 10:27:13 UTC,1,"British Steel set to be nationalised, Starmer says",https://www.bbc.co.uk/news/articles/c8xwg0gdrpzo
2026-05-11 10:27:13 UTC,2,"Martin Lewis delivers emotional speech, and nine other Bafta TV moments",https://www.bbc.co.uk/news/articles/c8e86ykkx5jo
2026-05-11 10:27:13 UTC,3,Tourist hotspot at 'end of the world' denies causing hantavirus outbreak,https://www.bbc.co.uk/news/articles/cx21ej471g2o
2026-05-11 10:27:13 UTC,4,Man charged after car hits five people in town centre,https://www.bbc.co.uk/news/articles/ce9pvxkpz9vo
2026-05-11 10:27:13 UTC,5,Star Wars and Shakespeare actor Michael Pennington dies aged 82,https://www.bbc.co.uk/news/articles/cdepdpwpp5jo
2026-05-11 10:27:13 UTC,6,Trump calls Iran response to US proposal to end war 'totally unacceptable',https://www.bbc.co.uk/news/articles/clypgz9e5pmo
2026-05-11 10:27:13 UTC,7,"My sister was spending £1,000 a month on drink from delivery apps",https://www.bbc.co.uk/news/articles/cd9pn581xzwo
2026-05-11 10:27:13 UTC,8,British passengers from hantavirus-hit cruise ship isolating in hospital,https://www.bbc.co.uk/news/articles/c4g83vddnz0o
2026-05-11 10:27:13 UTC,9,US and French nationals test positive for hantavirus after leaving ship,https://www.bbc.co.uk/news/articles/cjep78l5835o
2026-05-11 10:27:13 UTC,10,Why Eurovision's fallout over Israel may change the competition forever,https://www.bbc.co.uk/news/articles/cgkpgm6vk48o
