timestamp,position,title,link
2026-06-19 00:19:24 UTC,1,Live.ÂVotes being counted in crucial Makerfield by-election,https://www.bbc.co.uk/news/live/c3928mlyle8t
2026-06-19 00:19:24 UTC,2,Man arrested on suspicion of attempted murder after boy injured in crocodile enclosure,https://www.bbc.co.uk/news/articles/czx50n2vj74o
2026-06-19 00:19:24 UTC,3,US lifts naval blockade as Iran's supreme leader says Trump made deal 'out of desperation',https://www.bbc.co.uk/news/articles/c8r2eejdd35o
2026-06-19 00:19:24 UTC,4,Bowen: US-Iran deal raises inescapable question of what the war was for,https://www.bbc.co.uk/news/articles/clyegr2mp8jo
2026-06-19 00:19:24 UTC,5,Teacher who murdered adopted baby son Preston Davey given whole life prison sentence,https://www.bbc.co.uk/news/articles/czrx8gj112mo
2026-06-19 00:19:24 UTC,6,Hegseth renews Nato criticism and says US will review presence in Europe,https://www.bbc.co.uk/news/articles/c3vy5l62622o
2026-06-19 00:19:24 UTC,7,"Foreign Office drops 'do not travel' advice for Dubai, but calls situation unpredictable",https://www.bbc.co.uk/news/articles/cddl29lg5gro
2026-06-19 00:19:24 UTC,8,Tuchel's national anthem complaints lead to Fifa moving photographers,https://www.bbc.co.uk/sport/football/articles/cdejd2p65k3o
2026-06-19 00:19:24 UTC,9,BBC pulls new Ashley Cain series after sexist language accusations,https://www.bbc.co.uk/news/articles/crr872992jjo
2026-06-19 00:19:24 UTC,10,Moscow residents complain of black rain after largest Ukrainian attack hits oil refinery,https://www.bbc.co.uk/news/articles/c98291g5rr1o
2026-06-19 06:07:23 UTC,1,"Live.ÂBurnham wins Makerfield by-election, paving way for Starmer leadership challenge",https://www.bbc.co.uk/news/live/c3928mlyle8t
2026-06-19 06:07:23 UTC,2,Chris Mason: Emphatic win leaves Starmer with big decision on leadership,https://www.bbc.co.uk/news/articles/cqx1eq5e71zo
2026-06-19 06:07:23 UTC,3,"Burnham says 'this is a final chance to change' in his victory speech. Video, 00:05:46Burnham says 'this is a final chance to change' in his victory speech",https://www.bbc.co.uk/news/videos/cvg5drz91ego
2026-06-19 06:07:23 UTC,4,Scottish Conservatives win first Westminster by-election in more than 50 years,https://www.bbc.co.uk/news/articles/cpv3kk3nlj1o
2026-06-19 06:07:23 UTC,5,Sir John Curtice: Burnham's win against Reform represents remarkable personal success,https://www.bbc.co.uk/news/articles/clyeg121g2zo
2026-06-19 06:07:23 UTC,6,US lifts naval blockade as Iran's supreme leader says Trump made deal 'out of desperation',https://www.bbc.co.uk/news/articles/c8r2eejdd35o
2026-06-19 06:07:23 UTC,7,What Iran and US get from deal and why both could struggle to keep it,https://www.bbc.co.uk/news/articles/c932yqz8lggo
2026-06-19 06:07:23 UTC,8,Man arrested on suspicion of attempted murder after boy injured in crocodile enclosure,https://www.bbc.co.uk/news/articles/czx50n2vj74o
2026-06-19 06:07:23 UTC,9,The pressure on the Church of England to ditch its slavery reparations plan,https://www.bbc.co.uk/news/articles/c5yz43n9513o
2026-06-19 06:07:23 UTC,10,London Marathon to be two-day event in 2027,https://www.bbc.co.uk/sport/athletics/articles/c892p7d0kk8o
2026-06-19 11:12:55 UTC,1,Live.ÂBurnham says he will 'lay out new path for Britain' as Starmer vows to fight in any leadership contest,https://www.bbc.co.uk/news/live/c3928mlyle8t
2026-06-19 11:12:55 UTC,2,Chris Mason: Emphatic win leaves Starmer with big decision on leadership,https://www.bbc.co.uk/news/articles/cqx1eq5e71zo
2026-06-19 11:12:55 UTC,3,Farage blames Makerfield defeat on anti-Starmer votes,https://www.bbc.co.uk/news/articles/cvgqvj8dkz7o
2026-06-19 11:12:55 UTC,4,What is Burnham's path to becoming Labour leader and PM?,https://www.bbc.co.uk/news/articles/c3631k30xjlo
2026-06-19 11:12:55 UTC,5,Scottish Conservatives win first Westminster by-election in more than 50 years,https://www.bbc.co.uk/news/articles/cpv3kk3nlj1o
2026-06-19 11:12:55 UTC,6,Sir John Curtice: Burnham's win against Reform represents remarkable personal success,https://www.bbc.co.uk/news/articles/clyeg121g2zo
2026-06-19 11:12:55 UTC,7,"Boy, 3, was attacked by crocodile at zoo as man bailed",https://www.bbc.co.uk/news/articles/cp9l2278m8no
2026-06-19 11:12:55 UTC,8,US-Iran talks postponed as Vance pulls out of Switzerland trip,https://www.bbc.co.uk/news/articles/c8r2eme2n5do
2026-06-19 11:12:55 UTC,9,"Scotland fans fly 22 hours in tiny plane to World Cup. Video, 00:01:31Scotland fans fly 22 hours in tiny plane to World Cup",https://www.bbc.co.uk/news/videos/cx2j75vg4p1o
2026-06-19 11:12:55 UTC,10,Morocco captain Achraf Hakimi to stand trial for rape,https://www.bbc.co.uk/sport/football/articles/c20y18z7le1o
2026-06-19 14:41:11 UTC,1,Starmer warns Labour against 'turning on each other' after Burnham's convincing Makerfield win,https://www.bbc.co.uk/news/live/c3928mlyle8t
2026-06-19 14:41:11 UTC,2,The key figures in Andy Burnham's inner circle,https://www.bbc.co.uk/news/articles/c8621d1egw1o
2026-06-19 14:41:11 UTC,3,"Israel and Hezbollah agree to ceasefire, US official confirms",https://www.bbc.co.uk/news/live/cy9r022nqz9t
2026-06-19 14:41:11 UTC,4,"Boy, 3, hurt at zoo was attacked by a crocodile, BBC understands",https://www.bbc.co.uk/news/articles/cp9l2278m8no
2026-06-19 14:41:11 UTC,5,'Neither I nor Italy ever beg': Meloni says Trump made up story about photo,https://www.bbc.co.uk/news/articles/c20y1ygn707o
2026-06-19 14:41:11 UTC,6,Scottish Conservatives win first Westminster by-election in more than 50 years,https://www.bbc.co.uk/news/articles/cpv3kk3nlj1o
2026-06-19 14:41:11 UTC,7,Amber extreme heat warning issued as 35C heatwave approaches,https://www.bbc.co.uk/weather/articles/cz0jde5xkjvo
2026-06-19 14:41:11 UTC,8,Scotland v Morocco build-up: Tartan Army gather in Boston as Clarke's side bid for history,https://www.bbc.co.uk/sport/football/live/cr47z6re5lpt
2026-06-19 14:41:11 UTC,9,Two men jailed over Starmer-linked arson attacks,https://www.bbc.co.uk/news/articles/cgmdjpmmng7o
2026-06-19 14:41:11 UTC,10,Six-year-old Ebola patient taken from DR Congo hospital found and 'doing well',https://www.bbc.co.uk/news/articles/c0qyg29wpk2o
2026-06-19 17:10:55 UTC,1,Starmer facing calls to set out timetable for departure after Burnham's Makerfield win,https://www.bbc.co.uk/news/live/c3928mlyle8t
2026-06-19 17:10:55 UTC,2,Henry Zeffman: What does Keir Starmer do next after Andy Burnham's Makerfield win?,https://www.bbc.co.uk/news/articles/c3ryp0nejdro
2026-06-19 17:10:55 UTC,3,Israel and Hezbollah agree to ceasefire as continued strikes in Lebanon reported,https://www.bbc.co.uk/news/live/cy9r022nqz9t
2026-06-19 17:10:55 UTC,4,"Boy, 3, hurt at zoo was attacked by a crocodile",https://www.bbc.co.uk/news/articles/cp9l2278m8no
2026-06-19 17:10:55 UTC,5,'Neither I nor Italy ever beg': Meloni says Trump made up story about photo,https://www.bbc.co.uk/news/articles/c20y1ygn707o
2026-06-19 17:10:55 UTC,6,"Historic by-election win sends message to Labour and SNP, says Badenoch",https://www.bbc.co.uk/news/articles/cn8q4p34qg4o
2026-06-19 17:10:55 UTC,7,Why Morocco game could be greatest of all for Scotland,https://www.bbc.co.uk/sport/football/articles/cy04jqn90wko
2026-06-19 17:10:55 UTC,8,Amber extreme heat warning issued as 35C heatwave approaches,https://www.bbc.co.uk/weather/articles/cz0jde5xkjvo
2026-06-19 17:10:55 UTC,9,Minimum age of 11 set for UK puberty blocker trial,https://www.bbc.co.uk/news/articles/c892p2qdjjxo
2026-06-19 17:10:55 UTC,10,US to end funding of South Africa's HIV programmes over claims of Afrikaner persecution,https://www.bbc.co.uk/news/articles/cdr457lxr71o
2026-06-19 19:24:17 UTC,1,Live.ÂTwo passenger trains collide near Bedford with major emergency response under way,https://www.bbc.co.uk/news/live/cy8dy2pr8ymt
2026-06-19 19:24:17 UTC,2,"Video shows scene of Bedford train crash as passenger describes aftermath. Video, 00:00:36Video shows scene of Bedford train crash as passenger describes aftermath",https://www.bbc.co.uk/news/videos/c8d21z2q77do
2026-06-19 19:24:17 UTC,3,PM under pressure from Labour MPs and ministers to set timetable for exit,https://www.bbc.co.uk/news/articles/cqx1ev0wn87o
2026-06-19 19:24:17 UTC,4,Henry Zeffman: What does Keir Starmer do next after Andy Burnham's Makerfield win?,https://www.bbc.co.uk/news/articles/c3ryp0nejdro
2026-06-19 19:24:17 UTC,5,"Israel and Hezbollah agree ceasefire, US says, as more Lebanon strikes reported",https://www.bbc.co.uk/news/articles/cwyk7kkygj5o
2026-06-19 19:24:17 UTC,6,"Boy, 3, hurt at zoo was attacked by a crocodile",https://www.bbc.co.uk/news/articles/cp9l2278m8no
2026-06-19 19:24:17 UTC,7,'Neither I nor Italy ever beg': Meloni says Trump made up story about photo,https://www.bbc.co.uk/news/articles/c20y1ygn707o
2026-06-19 19:24:17 UTC,8,Why Morocco game could be greatest of all for Scotland,https://www.bbc.co.uk/sport/football/articles/cy04jqn90wko
2026-06-19 19:24:17 UTC,9,'Prioritise love': Kate writes essay reflecting on Italy tour as new pictures released,https://www.bbc.co.uk/news/articles/c78y0gvmjy0o
2026-06-19 19:24:17 UTC,10,Amber extreme heat warning issued as 35C heatwave approaches,https://www.bbc.co.uk/weather/articles/cz0jde5xkjvo
2026-06-19 21:00:09 UTC,1,Live.ÂOne dead and several injured in Bedford train crash as police declare major incident,https://www.bbc.co.uk/news/live/cy8dy2pr8ymt
2026-06-19 21:00:09 UTC,2,"Video shows scene of Bedford train crash as passenger describes aftermath. Video, 00:00:36Video shows scene of Bedford train crash as passenger describes aftermath",https://www.bbc.co.uk/news/videos/c8d21z2q77do
2026-06-19 21:00:09 UTC,3,What we know so far about Bedford train crash,https://www.bbc.co.uk/news/articles/cn75z3nl048o
2026-06-19 21:00:09 UTC,4,PM under pressure from Labour MPs and ministers to set timetable for exit,https://www.bbc.co.uk/news/articles/cqx1ev0wn87o
2026-06-19 21:00:09 UTC,5,"Israel and Hezbollah agree ceasefire, US says, as more Lebanon strikes reported",https://www.bbc.co.uk/news/articles/cwyk7kkygj5o
2026-06-19 21:00:09 UTC,6,"Boy, 3, hurt at zoo was attacked by a crocodile",https://www.bbc.co.uk/news/articles/cp9l2278m8no
2026-06-19 21:00:09 UTC,7,"Scotland face Morocco in second World Cup game - Tierney, Christie & Patterson in",https://www.bbc.co.uk/sport/football/live/crr8dw70x51t
2026-06-19 21:00:09 UTC,8,'Neither I nor Italy ever beg': Meloni says Trump made up story about photo,https://www.bbc.co.uk/news/articles/c20y1ygn707o
2026-06-19 21:00:09 UTC,9,Amber extreme heat warning issued as 35C heatwave approaches,https://www.bbc.co.uk/weather/articles/cz0jde5xkjvo
2026-06-19 21:00:09 UTC,10,Minimum age of 11 set for UK puberty blocker trial,https://www.bbc.co.uk/news/articles/c892p2qdjjxo
2026-06-19 22:06:15 UTC,1,Live.ÂOne dead and 11 very seriously injured in Bedford train crash as police declare major incident,https://www.bbc.co.uk/news/live/cy8dy2pr8ymt
2026-06-19 22:06:15 UTC,2,'People flew from their seats': Passengers describe how Bedford train crash unfolded,https://www.bbc.co.uk/news/articles/cx2j700l5jlo
2026-06-19 22:06:15 UTC,3,"Video shows scene of Bedford train crash as passenger describes aftermath. Video, 00:00:36Video shows scene of Bedford train crash as passenger describes aftermath",https://www.bbc.co.uk/news/videos/c8d21z2q77do
2026-06-19 22:06:15 UTC,4,What we know so far about Bedford train crash,https://www.bbc.co.uk/news/articles/cn75z3nl048o
2026-06-19 22:06:15 UTC,5,Morocco lead Scotland after 71 seconds with stunning opener,https://www.bbc.co.uk/sport/football/live/crr8dw70x51t
2026-06-19 22:06:15 UTC,6,PM under pressure from Labour MPs and ministers to set timetable for exit,https://www.bbc.co.uk/news/articles/cqx1ev0wn87o
2026-06-19 22:06:15 UTC,7,"Israel and Hezbollah agree ceasefire, US says, as more Lebanon strikes reported",https://www.bbc.co.uk/news/articles/cwyk7kkygj5o
2026-06-19 22:06:15 UTC,8,"Boy, 3, hurt at zoo was attacked by a crocodile",https://www.bbc.co.uk/news/articles/cp9l2278m8no
2026-06-19 22:06:15 UTC,9,'Neither I nor Italy ever beg': Meloni says Trump made up story about photo,https://www.bbc.co.uk/news/articles/c20y1ygn707o
2026-06-19 22:06:15 UTC,10,Amber extreme heat warning issued as 35C heatwave approaches,https://www.bbc.co.uk/weather/articles/cz0jde5xkjvo
