timestamp,position,title,link
2026-05-29 00:01:43 UTC,1,Sturgeon says estranged husband betrayed and deceived her about embezzling SNP money,https://www.bbc.co.uk/news/articles/cpdp3d8792no
2026-05-29 00:01:43 UTC,2,"US and Iran 'very close' to deal but 'not there yet', Vance says",https://www.bbc.co.uk/news/articles/c87qng40wz9o
2026-05-29 00:01:43 UTC,3,"Opportunities shrinking for too many young people, says major report on 'lost generation'",https://www.bbc.co.uk/news/articles/cy026x9jpd0o
2026-05-29 00:01:43 UTC,4,'I've applied for more than 400 roles' - how young people are facing the job shortage,https://www.bbc.co.uk/news/articles/czx2qll4rlyo
2026-05-29 00:01:43 UTC,5,Man jailed for 15 years over plot to attack Taylor Swift concert in Vienna,https://www.bbc.co.uk/news/articles/cgrp7y05l9do
2026-05-29 00:01:43 UTC,6,Prostate cancer screening only for 'a few thousand' high risk men,https://www.bbc.co.uk/news/articles/cn0pvxe5jgzo
2026-05-29 00:01:43 UTC,7,Two more boys die in latest heatwave water deaths,https://www.bbc.co.uk/news/articles/cn0p7j3lwepo
2026-05-29 00:01:43 UTC,8,Starmer defends policy decisions as he hits back at Blair,https://www.bbc.co.uk/news/articles/cvgzjg778jyo
2026-05-29 00:01:43 UTC,9,Portugal breaks hottest May day record as Europe swelters in heatwave,https://www.bbc.co.uk/news/articles/c3v2yv5207xo
2026-05-29 00:01:43 UTC,10,"Israel intensifies strikes on Lebanon during ceasefire, videos show. Video, 00:01:24Israel intensifies strikes on Lebanon during ceasefire, videos show",https://www.bbc.co.uk/news/videos/c4g0kqxqz92o
2026-05-29 05:04:34 UTC,1,"US and Iran 'very close' to deal but 'not there yet', Vance says",https://www.bbc.co.uk/news/articles/c87qng40wz9o
2026-05-29 05:04:34 UTC,2,"SAS troops accused of war crimes not referred to police over morale fears, inquiry hears",https://www.bbc.co.uk/news/articles/c5y708l015mo
2026-05-29 05:04:34 UTC,3,"Epstein survivors lack faith in UK police investigating Andrew, says lawyer",https://www.bbc.co.uk/news/articles/c8r8nxvzyljo
2026-05-29 05:04:34 UTC,4,"Moment Blue Origin rocket explodes during test in Florida. Video, 00:00:28Moment Blue Origin rocket explodes during test in Florida",https://www.bbc.co.uk/news/videos/cvgz0pdg32mo
2026-05-29 05:04:34 UTC,5,AI facial recognition to check age of asylum seekers from next year,https://www.bbc.co.uk/news/articles/ce3pe36qe7ro
2026-05-29 05:04:34 UTC,6,Are 'heat spikes' becoming more common?,https://www.bbc.co.uk/weather/articles/clyp513ynv3o
2026-05-29 05:04:34 UTC,7,Russian drone crashes into apartment building in Romania,https://www.bbc.co.uk/news/articles/c93x4nxlkjeo
2026-05-29 05:04:34 UTC,8,Man jailed for 15 years over plot to attack Taylor Swift concert in Vienna,https://www.bbc.co.uk/news/articles/cgrp7y05l9do
2026-05-29 05:04:34 UTC,9,Netanyahu says he has directed IDF to increase control of Gaza to 70%,https://www.bbc.co.uk/news/articles/ceqpelq5reqo
2026-05-29 05:04:34 UTC,10,Sturgeon says estranged husband betrayed and deceived her about embezzling SNP money,https://www.bbc.co.uk/news/articles/cpdp3d8792no
2026-05-29 09:33:57 UTC,1,EU says Russia has crossed 'another line' after drone hits Romanian apartment block,https://www.bbc.co.uk/news/live/cdepwzz23j0t
2026-05-29 09:33:57 UTC,2,"US and Iran 'very close' to deal but 'not there yet', Vance says",https://www.bbc.co.uk/news/articles/c87qng40wz9o
2026-05-29 09:33:57 UTC,3,"Moment Blue Origin rocket explodes during test in Florida. Video, 00:01:09Moment Blue Origin rocket explodes during test in Florida",https://www.bbc.co.uk/news/videos/cvgz0pdg32mo
2026-05-29 09:33:57 UTC,4,"SAS troops accused of war crimes not referred to police over morale fears, inquiry hears",https://www.bbc.co.uk/news/articles/c5y708l015mo
2026-05-29 09:33:57 UTC,5,"Epstein survivors lack faith in UK police investigating Andrew, says lawyer",https://www.bbc.co.uk/news/articles/c8r8nxvzyljo
2026-05-29 09:33:57 UTC,6,Two charged after bystander fatally shot outside bar,https://www.bbc.co.uk/news/articles/cr5pjd43y80o
2026-05-29 09:33:57 UTC,7,Are 'heat spikes' becoming more common?,https://www.bbc.co.uk/weather/articles/clyp513ynv3o
2026-05-29 09:33:57 UTC,8,'I forgot what it feels like to be outside' - UK's first rooftop intensive care ward opens,https://www.bbc.co.uk/news/articles/cm2p1pzzmyeo
2026-05-29 09:33:57 UTC,9,More pharmacies in England to prescribe medication from autumn,https://www.bbc.co.uk/news/articles/c2l2qk7ng89o
2026-05-29 09:33:57 UTC,10,AI will be used to estimate age of asylum seekers from next year,https://www.bbc.co.uk/news/articles/ce3pe36qe7ro
