timestamp,position,title,link
2025-12-11 00:57:23 UTC,1,Venezuela accuses US of 'piracy' after oil tanker seized off coast,https://www.bbc.co.uk/news/live/cy07yk63x80t
2025-12-11 00:57:23 UTC,2,British paratrooper killed in Ukraine 'lived life of courage',https://www.bbc.co.uk/news/articles/c4gpkr83p73o
2025-12-11 00:57:23 UTC,3,Why so many people break 20mph speed limits (it's more complicated than you think),https://www.bbc.co.uk/news/articles/c8e94pe6w9ro
2025-12-11 00:57:23 UTC,4,The reality facing England's busiest A&E unit as flu wave hits,https://www.bbc.co.uk/news/articles/crmdxky3p9wo
2025-12-11 00:57:23 UTC,5,"Humans making fire 350,000 years earlier than previously thought",https://www.bbc.co.uk/news/resources/idt-b9da7a6d-165b-492a-8785-235cd10e2e8e
2025-12-11 00:57:23 UTC,6,"Author Sophie Kinsella remembered as a 'wonderful, warm woman'",https://www.bbc.co.uk/news/articles/ce91d2m1gg7o
2025-12-11 00:57:23 UTC,7,Ex-Olympic swimmer Sharron Davies and Iceland boss Richard Walker among new peers,https://www.bbc.co.uk/news/articles/cx23pxxl7yno
2025-12-11 00:57:23 UTC,8,Rolling Stones finally approve Fatboy Slim sample after 25 years,https://www.bbc.co.uk/news/articles/c2dzre3z96go
2025-12-11 00:57:23 UTC,9,Last minute offer may avert strike by resident doctors,https://www.bbc.co.uk/news/articles/c4gk3d72mvzo
2025-12-11 00:57:23 UTC,10,US could ask UK tourists for five-year social media history before entry,https://www.bbc.co.uk/news/articles/c1dz0g2ykpeo
