timestamp,position,title,link
2026-05-14 02:08:53 UTC,1,Starmer warns leadership contest would 'plunge us into chaos' in pleas to ministers and MPs,https://www.bbc.co.uk/news/articles/cvgzv4eqdrno
2026-05-14 02:08:53 UTC,2,Chris Mason: Big moment ahead for Streeting to decide whether to go for it,https://www.bbc.co.uk/news/articles/c392djn3zzdo
2026-05-14 02:08:53 UTC,3,Hezbollah support endures in south Lebanon as ceasefire fails to stop war with Israel,https://www.bbc.co.uk/news/articles/c9d3g6deljyo
2026-05-14 02:08:53 UTC,4,Trump and Xi shake hands on red carpet ahead of high-stakes meeting in Beijing,https://www.bbc.co.uk/news/live/cvgz8qverzqt
2026-05-14 02:08:53 UTC,5,"Why is Donald Trump in China? BBC explains. Video, 00:01:11Why is Donald Trump in China? BBC explains",https://www.bbc.co.uk/news/videos/clypvn70783o
2026-05-14 02:08:53 UTC,6,"Higher Europe air fares 'inevitable', says industry head",https://www.bbc.co.uk/news/articles/clyprnelzxzo
2026-05-14 02:08:53 UTC,7,"'When the school bell goes, it's fight or flight' - the PTSD faced by NI's prison guards",https://www.bbc.co.uk/news/articles/cj3pjk0vjjpo
2026-05-14 02:08:53 UTC,8,Harry warns of 'deeply troubling' rise in antisemitism in UK,https://www.bbc.co.uk/news/articles/c8xw55q0elvo
2026-05-14 02:08:53 UTC,9,Car showroom owner 'heartbroken' after vehicles destroyed by fire,https://www.bbc.co.uk/news/articles/c86d09l7v49o
2026-05-14 02:08:53 UTC,10,Bodies of three young women pulled from sea off Brighton,https://www.bbc.co.uk/news/articles/c0e29n94ze4o
